"id","profileName","text","date","title","rating","images","helpful","variant:colour","variant:size","variant:style name"
"RK5Z7PG4ZC760","Jinoy","Average in all aspects. Doesn't stand out in any area but delivers in all. ANC is not that strong. Sound feels as if it is stuck inside your head - because of dull bass and sound profile that is bass heavy. Mic is good. However, when using in Google Meets, there is some lag/latency issues. Not entirely solved by enabling the in-app ""Game mode"" which is aimed to reduce latency issues.","Reviewed in India on 27 August 2023","Average","3.0 out of 5 stars","","0","Thunder Grey","Extra Large","Nord Buds 2"
"R230Q23T77CE2C","Jaisai","Sound Quality and latency is good. Ok for gaming, charge per buds is 4-5 hours of gaming. But after 3 months, one earbuds is not connecting, after sometime it will connect.","Reviewed in India on 24 August 2023","Best earbuds in the price range","3.0 out of 5 stars","","0","Thunder Grey","Extra Large","Nord Buds 2"
"R26PCNXX27I61N","Placeholder","If you are buying and trying to switch between apple and android it is jot working . You need to pair it each time","Reviewed in India on 21 August 2023","Multi device switching between apple and android is an issue","3.0 out of 5 stars","","0","Thunder Grey","Extra Large","Nord Buds 2"
"R1ADKDLPO05RUL","prvnkc2","Falls off while working out. Noise cancellation are all average. Good for the price though","Reviewed in India on 20 August 2023","Falls off while working out. Noise cancellation are all average. Good for the price though","3.0 out of 5 stars","","0","Lightning White","Extra Large","Nord Buds 2"
"RKHRWBMB0PM6G","Premium Pad","Call receive function is not there","Reviewed in India on 19 August 2023","Good One","3.0 out of 5 stars","","0","Lightning White","Extra Large","Nord Buds 2"
"RRLGR1NONNDP7","Teja","In this price point, its okay to use to listen music, but not to talk!","Reviewed in India on 14 August 2023","Its okay okay TWS","3.0 out of 5 stars","","0","Thunder Grey","Extra Large","Nord Buds 2"
"R1L4LMHYBDOBF","Common Reviewer","This buds come with single pairing if you want to connect other phone first unpair your device than it will connect to other and the procedure is to open the lead and hold back button then white light blinks slowly now your buds is in pairing mode but it pairs one device at time.Thank you","Reviewed in India on 13 August 2023","Single pairing","3.0 out of 5 stars","https://m.media-amazon.com/images/I/813MexmnWnL.jpg","0","Lightning White","Extra Large","Nord Buds 2"
"RK0LAT3CA3BFI","Parth ","Everything is good except Earbuds start to hurt within a couple of hours after putting in the ears.","Reviewed in India on 13 August 2023","Best audio quality","3.0 out of 5 stars","","0","Thunder Grey","Extra Large","Nord Buds 2"
"RL6STI9PWYLLG","ashish gupta","The sound quality is too average... The bass is too loud and it can cause you auditory fatigue if you use these earbuds for a long time... Noise cancellation is quite good... Not worth product in the range of 3000 INR","Reviewed in India on 10 August 2023","Average product","3.0 out of 5 stars","","0","Thunder Grey","Extra Large","Nord Buds 2"
"RN9NO1PVSCOPT","Mantej Singh ","Product is good under this range but when it comes to wearing it for a long hours even for at least 1 hour, it's quite uncomfortable to use it . It causes pain to my right ear, idont know why but it's not comfortable to wear as compared to left side earbud.","Reviewed in India on 10 August 2023","Uncomfortable to wear","3.0 out of 5 stars","","0","Thunder Grey","Extra Large","Nord Buds 2"
"R1Q1Q7LBN7VYT1","Sakti Prasad Sahoo","This ear buds from OnePlus is a good one in this price range that offers good sound quality, bass and noise cancellation feature. It works well for voice call as well.But, it fails badly in fitting to the ear and comes out quite frequently. This earbuds is strictly not for use while moving and even if you are doing work near water container. There are high chances of it failling down.","Reviewed in India on 10 August 2023","Earbuds with good sound quality and bass, yet bad fitting to ear","3.0 out of 5 stars","","0","Thunder Grey","Extra Large","Nord Buds 2"
"R3UNLYAL1B9L1H","Revanth Kumar","I am writing this review after using this product for a week. I have a very good opinion on OnePlus brand as I am using this brand products from last 4 years. But after using this buds I changed my mind. The calling experience is horrible even in the closed room. You can't even enjoy the music in busy roads when the ANC is on. My sincere advice to all of those who are willing to buy this product is to HOLD until the mic issue is fixed from their end. You can do a Google search about the mic issues of this product. I missed doing it and now feeling regret after purchasing this buds.","Reviewed in India on 9 August 2023","Very Poor calling experience","3.0 out of 5 stars","","0","Thunder Grey","Extra Large","Nord Buds 2"
"R9TPOZ3UEJRTJ","K P Nagendrachari","Not Worth for Money","Reviewed in India on 6 August 2023","Not Worth for Money","3.0 out of 5 stars","","0","Thunder Grey","Extra Large","Nord Buds 2"
"R52NSZ6OOM86R","Shaffiullah","Let me tell you with my experience. This was very good buds everything about it is good! However, now it’s been almost 2 years since I bought these now my one side buds volume has reduced. To be precise Left ear working at 90% & Right ear working at 20%.It’s like as time passed it quality fades away!I’m not telling not to buy these buds. But know for a fact that these has life span of 2 years max!","Reviewed in India on 5 August 2023","2 Years life only!","3.0 out of 5 stars","","0","Thunder Grey","Extra Large","Nord Buds 2"
"R1JV5CIOEN78WA","Ram","Anc & transparency is not up to mark i have used crossbeats which were very good in anc & transparency mode compare to this buds","Reviewed in India on 4 August 2023","ANC & transparency","3.0 out of 5 stars","","0","Thunder Grey","Extra Large","Nord Buds 2"
"R2I9C81CX23HJY","Danny rawal","It only gives u 3-4 days battery no matter you are using it for 2-3 hrs per day , tht means the promise of giving battery backup of 36-38 hrs if not related to using it , the total battery backup is only 10-12 hrs with case, although sound is good .","Reviewed in India on 4 August 2023","Not happy with battery backup","3.0 out of 5 stars","https://m.media-amazon.com/images/I/61aMVZvutQL.jpg","0","Thunder Grey","Extra Large","Nord Buds 2"
"R2JLAJHMUFKDSU","Hrishikesh Naigaonkar","Overall its a good product. But for people who want detailing in their sound its a pretty average product. The noise cancellation is good but frequencies from 8k-16k jitter alot.","Reviewed in India on 2 August 2023","Good product but could be better","3.0 out of 5 stars","","0","Thunder Grey","Extra Large","Nord Buds 2"
"R1YAZR3WOEFIXW","Indraneel bhattacharya","Wow!!Go for it best in the budget it is offering.ANC work perfectly bass good overall balanced sound.Cheers","Reviewed in India on 18 January 2024","Best in the price!!","4.0 out of 5 stars","","0","Thunder Grey","Extra Large","Nord Buds 2"
"R1FLPPDMT6MIWS","ASHUTOSH KUMAR VISHWAKARMA","Buds2 is also very good clear calling ,but and feature is not so goodRealme t300 calling quality is bad.Avoid realme t300 to buy.","Reviewed in India on 16 January 2024","One plus buds is good choice.","4.0 out of 5 stars","","0","Thunder Grey","Extra Large","Nord Buds 2"
"RDVGYKNC2TIZS","Tanmay Jadhav","Nice sound quality. 3 Different size of buds provided. Overall worth it. Better than any other earbuds of OnePlus. Colour of case is also different than shown in figure.","Reviewed in India on 10 January 2024","Nice Product","4.0 out of 5 stars","","0","Thunder Grey","Extra Large","Nord Buds 2"
"RGKNPU9Z43CO","Suman dolai",false,"Reviewed in India on 6 January 2024","Very nice music bass","4.0 out of 5 stars","https://m.media-amazon.com/images/I/61O49O54zPL.jpg","0","Lightning White","Extra Large","Nord Buds 2"
"R3811NT7Y988PN","Arun","After using it for 2 years , Switch device from laptop to mobile is missing but overall good to go. Good battery , fast charging","Reviewed in India on 31 December 2023","Switch device from laptop to mobile is missing","4.0 out of 5 stars","","0","White Marble","Extra Large","Nord Buds"
"RTLOHP923CA06","PRASHANTH DK","cant compare to JBL, FOR THE PRICE ITS WORTH","Reviewed in India on 22 December 2023","for the price its worth","4.0 out of 5 stars","","0","Thunder Grey","Extra Large","Nord Buds 2"
"R23MV3FGFCEK9L","Bhoopendra kumar",false,"Reviewed in India on 17 December 2023","Good Fitting But expensive 🫰🫰🫰🫰","4.0 out of 5 stars","https://m.media-amazon.com/images/I/61VVieYX1yL.jpg
https://m.media-amazon.com/images/I/71KdRSEWJ0L.jpg
https://m.media-amazon.com/images/I/71PR7AKKBUL.jpg
https://m.media-amazon.com/images/I/71eumV7QX3L.jpg","0","Thunder Grey","Extra Large","Nord Buds 2"
"R1888U7KNS50NV","Debraj Mondal","Headphone is great but battery backup is not good","Reviewed in India on 12 December 2023","In one word, the headphone is a great headphone","4.0 out of 5 stars","","0","Thunder Grey","Extra Large","Nord Buds 2"
"R22ZFZKWT1Q0QI","Abhishek ",false,"Reviewed in India on 11 December 2023","Worth the money.","4.0 out of 5 stars","","0","Thunder Grey","Extra Large","Nord Buds 2"
"R2YQYNKNVAGUR1","Pawan Soni","Good,  not wow","Reviewed in India on 10 December 2023","Good","4.0 out of 5 stars","","0","Thunder Grey","Extra Large","Nord Buds 2"
"R3BMRMFCJY51T1","Rahul Sah","One of the best earphones i bought under 2500, its ANC feature is really good and overall the product is nice.","Reviewed in India on 10 December 2023","Best Product","4.0 out of 5 stars","https://m.media-amazon.com/images/I/51wpd-xGK0L.jpg
https://m.media-amazon.com/images/I/61WgBfCzU-L.jpg
https://m.media-amazon.com/images/I/61fLC1UM-BL.jpg","0","Lightning White","Extra Large","Nord Buds 2"
"R3JC62AIKCQ3II","Placeholder","Nice","Reviewed in India on 8 December 2023","Nice","4.0 out of 5 stars","","0","Thunder Grey","Extra Large","Nord Buds 2"
"RQST85P0BCILA","Gurunath Gadkari","Sound quality is really goodAwesome noise cancellation quality","Reviewed in India on 6 December 2023","Sound Quality","4.0 out of 5 stars","https://m.media-amazon.com/images/I/71Je2CBqYNL.jpg
https://m.media-amazon.com/images/I/81QHon+gUKL.jpg","0","Thunder Grey","Extra Large","Nord Buds 2"
"R3NBAXC425XOP0","Vivek Kamble","Good earbuds value for money 💰 sound quality of earbuds damn good 👍 Battery also very good  best product  good quality","Reviewed in India on 6 December 2023","Value for money 💰","4.0 out of 5 stars","","0","Thunder Grey","Extra Large","Nord Buds 2"
"R350TNQ6SOTD81","Rajandeep","Sound quality is good like expensive earbuds. Best earbuds under 3k i say.","Reviewed in India on 3 December 2023","Sound","4.0 out of 5 stars","","0","Thunder Grey","Extra Large","Nord Buds 2"
"R29EHXGNHTSG51","This is bad product ","Good product","Reviewed in India on 3 December 2023","Good product","4.0 out of 5 stars","","0","Thunder Grey","Extra Large","Nord Buds 2"
"R7JF87R7P8LYX","Pavan Raj.R.S","No volume controls , except this all are good !","Reviewed in India on 2 December 2023","Good!","4.0 out of 5 stars","https://m.media-amazon.com/images/I/71E0fZzCYCL.jpg
https://m.media-amazon.com/images/I/81vxbRb5idL.jpg","0","Thunder Grey","Extra Large","Nord Buds 2"
"R2HAIXSDKMT4Z2","Ashique Ambily","Good battery, ANC and built quality for this price segmentSatisfied","Reviewed in India on 1 December 2023","Worth for fine","4.0 out of 5 stars","","0","Thunder Grey","Extra Large","Nord Buds 2"
"R25JBAL6WSBSQN","vivek singh","This is a great product by one plus but has one major flaw, it doesn't get connected to the phone/laptop via bluetooth unless I turn the paring mode on in the buds.","Reviewed in India on 30 November 2023","Connectivity sucks","4.0 out of 5 stars","","0","Thunder Grey","Extra Large","Nord Buds 2"
"R3HEOISS5OY5SN","Yogesh Sharma","Good quality","Reviewed in India on 29 November 2023","Good","4.0 out of 5 stars","","0","Thunder Grey","Extra Large","Nord Buds 2"
"R16CAWSRNU2NTY","R K S","Doesn't easily connect. ANC drains battery life","Reviewed in India on 27 November 2023","4 🌟 for battery life","4.0 out of 5 stars","","0","Thunder Grey","Extra Large","Nord Buds 2"
"R3PSG28XINMXG8","Chandrapal","Good","Reviewed in India on 27 November 2023","Very good","4.0 out of 5 stars","","0","Thunder Grey","Extra Large","Nord Buds 2"
"R1F1LJF6RUMEY7","Prashanth kankanala","The design is  Small and stylish, coming to audio excellent base, overall sounds are good, worth the price if anc present","Reviewed in India on 25 November 2023","Looks stylish","4.0 out of 5 stars","https://m.media-amazon.com/images/I/71jDm9BFIKL.jpg","0","Thunder Grey","Extra Large","Nord Buds 2"
"R2UBLKMP3O94E5","Akash","Very nice earbuds . Best at this price . Sound , Bass are well balanced and tuning is also very good. But, I think there could be a improvement in ANC as they are not upto mark. You can easily hear fan sounds also.Except that every thing is good","Reviewed in India on 24 November 2023","Value for money","4.0 out of 5 stars","https://m.media-amazon.com/images/I/71UjWZ3gH0L.jpg
https://m.media-amazon.com/images/I/71sW6x4ssQL.jpg","0","Thunder Grey","Extra Large","Nord Buds 2"
"R96CEH72N9WKQ","Munish","Music quality is good and bass is also good. Ear detection sensor is not working properly it keep pausing my song after 2 minutes. It is so irritating while playing your favourite playlist at night.","Reviewed in India on 24 November 2023","Ear detection is worst","4.0 out of 5 stars","https://m.media-amazon.com/images/I/616ldvjdXDL.jpg","0","Thunder Grey","Extra Large","Nord Buds 2"
"R2WP617BP0KEKG","vaibhav yadav","Overall good product but it have one problem it is disconnecting automatically so times","Reviewed in India on 22 November 2023","Good product disconnect automatically too Many times","4.0 out of 5 stars","","0","White Marble","Extra Large","Nord Buds"
"R2DRKEYEHH17NL","Nandigama Mahender","Good","Reviewed in India on 22 November 2023","Good","4.0 out of 5 stars","","0","Lightning White","Extra Large","Nord Buds 2"
"R1AITU4ULRV10R","Rohit Raghuwanshi","Some times it disconnects automatically while playing music","Reviewed in India on 20 November 2023","Good purchase","4.0 out of 5 stars","","0","Thunder Grey","Extra Large","Nord Buds 2"
"R1EDP3HGIUU8NE","Asim Mujawar","It's real good product , the mic quality, ANC mod also works better while calling, Gaming it has actually good low latency mod.Charging is I would say good while ANC mod the battery drains little bit fast as off without ANC mod. Fit in ear very comfortably","Reviewed in India on 19 November 2023","ANC mod","4.0 out of 5 stars","","0","Thunder Grey","Extra Large","Nord Buds 2"
"R27G1X3EEH7A3N","Sanket patil",false,"Reviewed in India on 18 November 2023","Nice product","4.0 out of 5 stars","https://m.media-amazon.com/images/I/61Gpo5vkvVL.jpg","0","Lightning White","Extra Large","Nord Buds 2"
"R2LOJI5R6ARMBC","Aboud","The product was as advertised and worth every penny","Reviewed in India on 20 January 2024","Excellent as advertised","5.0 out of 5 stars","","0","Thunder Grey","Extra Large","Nord Buds 2"
"R3SU4FO2O8CYH2","It's Amazing I loved it 😍","It's amazing sound and quickly connect . No need to wait for connect","Reviewed in India on 20 January 2024","Sound & design","5.0 out of 5 stars","","0","Thunder Grey","Extra Large","Nord Buds 2"
"R1PK0SLPB5PLNM","Shafiullah S A","Value for the money! Noise cancellation is super cool. Works on both android and ios devices.","Reviewed in India on 19 January 2024","Nice product!","5.0 out of 5 stars","https://m.media-amazon.com/images/I/51XqNeKLxaL.jpg","0","Thunder Grey","Extra Large","Nord Buds 2"
"RP35I8YDNMTQ9","Kishan kannoje",false,"Reviewed in India on 19 January 2024","Original Sound awesome 🥰👌😎 charging good parefamanece","5.0 out of 5 stars","https://m.media-amazon.com/images/I/71Jj4cCLPPL.jpg","0","Thunder Grey","Extra Large","Nord Buds 2"
"RBPVUFXAELS5F","Dipanshu juneja",false,"Reviewed in India on 18 January 2024","Great Sound! Good investment.","5.0 out of 5 stars","https://m.media-amazon.com/images/I/61kDknrhhgL.jpg","0","Thunder Grey","Extra Large","Nord Buds 2"
"R3TTJ4RP90T8AM","Akhilesh","Today use one plus earbuds nice sonund and sound clearly so good.","Reviewed in India on 18 January 2024","Nice sound","5.0 out of 5 stars","","0","Thunder Grey","Extra Large","Nord Buds 2"
"R219DS7POJ2ELW","Manoj kumar","Worth the price I paid..","Reviewed in India on 18 January 2024","Value for money","5.0 out of 5 stars","","0","Thunder Grey","Extra Large","Nord Buds 2"
"RA9W0N1QLXXWQ","Sachin kanakapur","Perfect balanced sound. Worth buying.","Reviewed in India on 17 January 2024","Music review","5.0 out of 5 stars","","0","Thunder Grey","Extra Large","Nord Buds 2"
"R8U9MN0OHVDHZ","Karan Thakur","These Buds are very gud,ANC work really well and sound quality is very nice.","Reviewed in India on 17 January 2024","Amazing Product","5.0 out of 5 stars","","0","Lightning White","Extra Large","Nord Buds 2"
"RYJZUCY1B99VZ","Vivek vijayan","Kollam poli sanam","Reviewed in India on 17 January 2024","Best product","5.0 out of 5 stars","https://m.media-amazon.com/images/I/71+m0ByCPiL.jpg","0","Thunder Grey","Extra Large","Nord Buds 2"
"R3NW3YI68YL88Z","Jay V","Quickly connects with the device. Properly fits inside the ear. Music sound quality could quality have been a bit better. Hope HeyMelody app will improve sound quality while listening music as it has customisation options. Let's see what happens.Would definitely recommend this product.","Reviewed in India on 17 January 2024","Deserves five stars for providing a premium quality products at a reasonable price point.","5.0 out of 5 stars","","0","Thunder Grey","Extra Large","Nord Buds 2"
"R3JQEUY4I3E3QF","Shweta","There are only 5 🌟  for rating ....I will give 5×5 for the superb noise cancellation, audio out put, fit , look ....just amazing experience","Reviewed in India on 16 January 2024","👌 👍","5.0 out of 5 stars","","0","Thunder Grey","Extra Large","Nord Buds 2"
"R2UWV0Q5J4NYY1","Amazon Customer","It withstands Long term usages.. good product","Reviewed in India on 15 January 2024","The value for money tws.!","5.0 out of 5 stars","","0","Thunder Grey","Extra Large","Nord Buds 2"
"RBT7RTO7L8LX9","K","Nice purchase.","Reviewed in India on 15 January 2024","Go for it.","5.0 out of 5 stars","","0","Thunder Grey","Extra Large","Nord Buds 2"
"R2ZTRVV9H4XLKR","Asim Ansari","Sound quality is awesome, you can go for it without any fear.","Reviewed in India on 15 January 2024","Best TWS","5.0 out of 5 stars","","0","Lightning White","Extra Large","Nord Buds 2"
"R3QBTYX9IN2N29","Ruby","Good","Reviewed in India on 14 January 2024","Good","5.0 out of 5 stars","","0","Thunder Grey","Extra Large","Nord Buds 2"
"RRT30KTE3ZZIG","K. Mathan",false,"Reviewed in India on 13 January 2024","2800 நம்பி வாங்கலாம் ஆயா சத்தியமா ரொம்ப நல்லாவே இருக்கு கண்டிப்பா தாராளமா வாங்கலாம்","5.0 out of 5 stars","https://m.media-amazon.com/images/I/61GmtZGi+hL.jpg
https://m.media-amazon.com/images/I/71XODhbEsJL.jpg","0","Lightning White","Extra Large","Nord Buds 2"
"R341R3MT7Z7YD4","Surya vamshi","Good","Reviewed in India on 13 January 2024","Good","5.0 out of 5 stars","","0","Thunder Grey","Extra Large","Nord Buds 2"
"RAJQNHI0XUDUC","Joyjit Adhikari","Peace of beauty.. just grabed it.. Anc is smooth not hurting my ears . Call quality is just superb. Music listening & fit quality is also top notch.","Reviewed in India on 12 January 2024","Jhakkaaas Buds","5.0 out of 5 stars","https://m.media-amazon.com/images/I/61+O2W+tfnL.jpg","0","Lightning White","Extra Large","Nord Buds 2"
"R2CDL87NBBNYK","vinuchandran","Greater build quality and sound quality than i expected","Reviewed in India on 10 January 2024","Awesome","5.0 out of 5 stars","","0","Thunder Grey","Extra Large","Nord Buds 2"
"RM1ZXSPZ4GB94","Arun","Quality good .amazing listening experience","Reviewed in India on 9 January 2024","Awesome product","5.0 out of 5 stars","","0","Thunder Grey","Extra Large","Nord Buds 2"
"R2M9DT898DJPJX","P. S. Rajesh Kumar","Clear & loud sound. Deep bass. Noice cancellation working perfectly. Bluetooth connectivity is also excellent. More options by downloading the app.","Reviewed in India on 9 January 2024","Awesome","5.0 out of 5 stars","https://m.media-amazon.com/images/I/815vG21LhnL.jpg","0","Lightning White","Extra Large","Nord Buds 2"
"R2C8KK9ADQTHDZ","Dheeraj Chaudhary","Sound 5/5Battery 5/4Look  5/5Overall Nice ......","Reviewed in India on 9 January 2024","GOOD PRODUCT 💯","5.0 out of 5 stars","https://m.media-amazon.com/images/I/61pW9nh009L.jpg","0","Thunder Grey","Extra Large","Nord Buds 2"
"R2DHTNUJQ6BOVV","dabhidoli","Awesome product in this price range.","Reviewed in India on 8 January 2024","Go for it","5.0 out of 5 stars","","0","Thunder Grey","Extra Large","Nord Buds 2"
"R26VUA1X91J5BF","Ravi","This is a good product, the buds get fully charged in 10 to15 minutes and lasts for at least 4 hours.","Reviewed in India on 8 January 2024","Excellent","5.0 out of 5 stars","https://m.media-amazon.com/images/I/61q5UY9lnhL.jpg","0","Thunder Grey","Extra Large","Nord Buds 2"
"RDZBA2L7E4Y8T","Piyush Chaudhary","Sound is very goodBass Is goodConnectivity is good over all a very good product at this price point","Reviewed in India on 7 January 2024","Good sound at this price","5.0 out of 5 stars","","0","Thunder Grey","Extra Large","Nord Buds 2"
"R2XL2S94WG4JFB","Chandan","If you are a bass lover this is the TWS for you it has a awesome bass with awesome design","Reviewed in India on 7 January 2024","Awesom TWS for bass lovers","5.0 out of 5 stars","","0","Lightning White","Extra Large","Nord Buds 2"
"R26KQDA7H2V54S","V PRASANNA KUMAR","Great product ….Sound is great…","Reviewed in India on 7 January 2024","Great","5.0 out of 5 stars","","0","Lightning White","Extra Large","Nord Buds 2"
"R8S93H35RRFEZ","Very good product ","Very compart and very good looking so and shine very good charging  save time ⏲️","Reviewed in India on 7 January 2024","Good and nice voice","5.0 out of 5 stars","","0","White Marble","Extra Large","Nord Buds"
"R1YS1XEVYMEI8Y","Shashank Shash","Very nice buds .Trust worthy","Reviewed in India on 7 January 2024","Nice buds","5.0 out of 5 stars","","0","Thunder Grey","Extra Large","Nord Buds 2"
"R139T7IJFZ1DXB","Kaushik Saha","Very good product quality. Connectivity and battery life also excellent. Super happy of taking the decision to buy it.","Reviewed in India on 6 January 2024","Excellent","5.0 out of 5 stars","","0","Thunder Grey","Extra Large","Nord Buds 2"
"R1YZPPF31AEUKN","Vansh Kumar",false,"Reviewed in India on 6 January 2024","Great bass and sound","5.0 out of 5 stars","https://m.media-amazon.com/images/I/610doHlAlUL.jpg
https://m.media-amazon.com/images/I/612sp70LqqL.jpg","0","Lightning White","Extra Large","Nord Buds 2"
"R21LFMXLNW3IIB","Suraj Yadav","Nice","Reviewed in India on 6 January 2024","Good","5.0 out of 5 stars","","0","Thunder Grey","Extra Large","Nord Buds 2"
"RDXHGZXD89Y4E","sruthi.m","Very good product worth the money","Reviewed in India on 5 January 2024","Value for money","5.0 out of 5 stars","","0","Thunder Grey","Extra Large","Nord Buds 2"
"R319UN4BN9QS5B","yogesh kumar","Affordable product with crystal clear sound. I like it..","Reviewed in India on 5 January 2024","Affordable product","5.0 out of 5 stars","","0","Thunder Grey","Extra Large","Nord Buds 2"
"R115CDLMTJHHBP","Yash","I like the sound and quality","Reviewed in India on 5 January 2024","Nice product","5.0 out of 5 stars","","0","Thunder Grey","Extra Large","Nord Buds 2"
"R1UHWEWKNHKLXW","pawan soni","Sound is very amezing","Reviewed in India on 5 January 2024","Suuuuuperv sound","5.0 out of 5 stars","","0","Thunder Grey","Extra Large","Nord Buds 2"
"R11FZQWH1YB0R9","Karan patel","I love my OnePlus Nord Buds 2! The sound quality is amazing, they're comfortable, and the noise cancellation works like a charm. Quick pairing, long battery life, and sleek design make them my top choice for wireless earbuds. Highly recommended!","Reviewed in India on 5 January 2024","OnePlus Nord Buds 2: Unmatched Sound, Comfort, and Style in Wireless Audio!","5.0 out of 5 stars","","0","Thunder Grey","Extra Large","Nord Buds 2"
"R23TJ678TE0O3B","KRRISH","Nice Product. Working Good","Reviewed in India on 4 January 2024","Ear Buds","5.0 out of 5 stars","","0","Thunder Grey","Extra Large","Nord Buds 2"
"R13TE352A8C5ZF","Mandeep k.","Nice","Reviewed in India on 4 January 2024","Nice","5.0 out of 5 stars","","0","Lightning White","Extra Large","Nord Buds 2"
"R39DB20LKIWB9S","Spicy Poison","The ANC of these ear buds is very effective and their sound quality is supreme.","Reviewed in India on 4 January 2024","Best ANC under 2999","5.0 out of 5 stars","","0","Thunder Grey","Extra Large","Nord Buds 2"
"R1LDMDLZXWJBY","Rahul Kumar","Does the job nicely, mic quality is good too, other party on call never complains that he is unable to hear, very nice","Reviewed in India on 3 January 2024","Superb","5.0 out of 5 stars","","0","Lightning White","Extra Large","Nord Buds 2"
"R24OJ81LDUMJWB","Julina nayak","Must buy its really good","Reviewed in India on 3 January 2024","Good product","5.0 out of 5 stars","","0","Lightning White","Extra Large","Nord Buds 2"
