"id","profileName","text","date","title","rating","images","helpful","variant:colour","variant:size","variant:style name"
"R3H7Q700H6BOGA","Kamlesh Sharma ","Can't control volume through buds tuch. Latency is almost zero while gaming 👍. Sound quality is very good. They're comfortable to use for all the day. Worth buying product but costly according to features. Noise cancellation is average.","Reviewed in India on 20 January 2024","Good one but costly.","4.0 out of 5 stars","","2","Thunder Grey","Extra Large","Nord Buds 2"
"RF70CC6TY1E3D","Dhanumathi","Major 2 Problems of this 1+ Nord 2..First one Bass is not good then 2nd One device to another device not connecting when reset button press then connect another device..","Reviewed in India on 29 January 2024","Connectivity Problem","3.0 out of 5 stars","","0","Thunder Grey","Extra Large","Nord Buds 2"
"R3D1JSTULS8NNH","Saurabh Kundu","I'm so happy with my OnePlus Nord Buds 2 TWS in Ear Earbuds! They are small and comfortable to wear, and they have a good bass that makes my music sound awesome. The only minor issue is that there is some slight distortion in the sound when I turn the volume to the max, but I don't do that often anyway. The battery life is amazing, it lasts me the whole day of usage without needing to charge. The ANC feature is good too, it blocks out most of the noise around me, but it feels a bit cheap compared to other brands. Overall, I think these earbuds are great and worth the price.","Reviewed in India on 10 November 2023","ALL GOOD","4.0 out of 5 stars","","27","Lightning White","Extra Large","Nord Buds 2"
"RU73STR04PPE2","sazeer","I bought this product recently. Used it full-fledged for about 10 days. I am using this product with realme gt2 pro.Lets talk about cons first1. Ear comfort of this product is ok but not  great. Using more than 1 hr ear  starts to hurt and painful. You need to  remove buds from ear and then keep  again to tackle the pain. I tried other ear  tips which comes in the box. tried small  ear tips which made comfort even worse  and painful.2 when audio is paused you will hear some  kind of gizzz sound which is very  annoying may be it is to handle outside  sound it seems. In transparency mode  gizz sound is less as you will hear outside  noise. When your not playing anything  keep buds aside or in the box donot  keep in ears. Trust me you will definitely  feel discomfort.3 ANC - Active Noise Cancellation is  working good but not great. You can still  hear outside noises. But it does have  difference. 50 percent of noises will be  reduced but not complete isolation.4 Hey Melody App. when phone bluetooth  is on buds will automatically pairs which  is great but when you go into app it still  shows select device to connect. But from  bluetooth settings i am able to select  and configure the product. I feel if device  is connected app should atleast show it  is connected.Pros 1. Sound Quality is great. 2. Bass is great. 3. Switching with between multiple device  is great as it wont automatically shift to  other device and you have to touch and  hold long to  shift and continue using. It  can be configure from app. 4. Battery backup is good. 5. Having ANC in this price is great. 6. Ear fitting is great. It wont fall from the  ear.Hope this review helps..!!","Reviewed in India on 20 May 2023","Worth the price","4.0 out of 5 stars","","502","Thunder Grey","Extra Large","Nord Buds 2"
"R1MAOS5BUM9G7N","Prathmesh jadhao","Quality of buds is not goodFiting is also very poor and batter backup is also dull","Reviewed in India on 3 February 2024","Not good enough","1.0 out of 5 stars","","0","Lightning White","Extra Large","Nord Buds 2"
"R22EGII262ZYEJ","Amazon Customer","Value for money","Reviewed in India on 3 February 2024","Good","5.0 out of 5 stars","","0","White Marble","Extra Large","Nord Buds"
"R3407A39PE98UT","Nice product, ","OnePlus company provide small Earbud caps and 2 pair of extra earbuds cap but it's also small in size , and I can't use other earbud caps , because case box can't adjust with that","Reviewed in India on 3 February 2024","Small Earbud caps","2.0 out of 5 stars","","0","Thunder Grey","Extra Large","Nord Buds 2"
"R1R27XN72537DM","pritamb540","For my normal ear It feels awesome.very good Noise cancellation.Bass quality is good.you have the option to customize the settings and control the sound quality.","Reviewed in India on 3 February 2024","Awesome sound","5.0 out of 5 stars","https://m.media-amazon.com/images/I/71EO5l7wEoL.jpg
https://m.media-amazon.com/images/I/71gZ9+hgvKL.jpg
https://m.media-amazon.com/images/I/71qGg4JCXUL.jpg","0","Thunder Grey","Extra Large","Nord Buds 2"
"R7F1N98KB1IWU","NAYAN KHEDKAR","The product is worth buying.. if your phone supports Dolby Atmos you'll definitely enjoy the music.","Reviewed in India on 3 February 2024","Good product","5.0 out of 5 stars","","0","Thunder Grey","Extra Large","Nord Buds 2"
"R143GZWRTFKIOL","Irfan khan","Calls are not cleared in driving, don't buy this product for driving purpose use.","Reviewed in India on 2 February 2024","Calls not cleared for driving","1.0 out of 5 stars","","0","Thunder Grey","Extra Large","Nord Buds 2"
"R3AG608LMRTMKH","Uday","Nice","Reviewed in India on 2 February 2024","Worth the price","5.0 out of 5 stars","","0","Thunder Grey","Extra Large","Nord Buds 2"
"R12ELYJAWFCA7J","ABHISEK BAXI BAHUBALENDRA","I am using this product from last one month.","Reviewed in India on 2 February 2024","Good Product by OnePlus","5.0 out of 5 stars","","0","Thunder Grey","Extra Large","Nord Buds 2"
"R3QRKPW4T0SNOX","Avinash Pant","Absolutely disappointed by Amazon, the right side earphone started making ticking noise just after 10 days of use and started getting worse, it is not even a month and it is literally annoying. I'm so pissed off getting defected product and return period is over as well. Don't buy electronics from these e commerce sites, directly go to company sites and buy them. Never ever gonna buy any electronics from Amazon. I also got a broken kettle and return request was getting cancelled automatically. Absolutely hate Amazon Flipkart etc.","Reviewed in India on 2 February 2024","The earphones started making ticking noise.","1.0 out of 5 stars","","0","Thunder Grey","Extra Large","Nord Buds 2"
"R1U4PPQTXI1KUR","Placeholder","Amazon made me fool. You can't hear music or talk more than 5 minutes. It's too much hurting in the ear. Please do not buy this buds. Amazon is making fool.","Reviewed in India on 2 February 2024","Amazon made me fool. You can't hear music or talk more than 5 minutes.","1.0 out of 5 stars","","0","Thunder Grey","Extra Large","Nord Buds 2"
"RKJ29TENS4WBP","Psyçhø Bøy Ñàráßímhä","Sound, comfort ok That's fine, but the battery runs out when you turn on Nose Consultin and argue.","Reviewed in India on 2 February 2024","Battery","3.0 out of 5 stars","https://m.media-amazon.com/images/I/51Ze8+9lD0L.jpg","0","Thunder Grey","Extra Large","Nord Buds 2"
"R32VBIUIM00RQQ","Good ","User friendly","Reviewed in India on 2 February 2024",".","5.0 out of 5 stars","","0","Thunder Grey","Extra Large","Nord Buds 2"
"RWIG23K9LP51","Amazon Customer","Fits in ear, great sound","Reviewed in India on 2 February 2024","Excellent","5.0 out of 5 stars","","0","Thunder Grey","Extra Large","Nord Buds 2"
"R1O39FLLDL7U16","customer","If you are a iphone user then don buy it.. its app “HeyMelody” doesn’t work in iphone. You can check their app reviews in app store. Without its app, the most of features will not work..","Reviewed in India on 2 February 2024","Not Compatible with iPhone","1.0 out of 5 stars","","0","Thunder Grey","Extra Large","Nord Buds 2"
"R1W9PCHR9NK90C","Chinmay Shelar","Speakers are farting not proper bass and I put it for refund stil money don’t came back order comes in 2 days and for my refund it will come in 12 days worst app amazon don’t buy again I need my refund back today it self","Reviewed in India on 2 February 2024","Worst quality","1.0 out of 5 stars","","0","Thunder Grey","Extra Large","Nord Buds 2"
"R3C06DUDCY2CDD","Ahmad Kamal Siddiqui","It is the best ear buds under this price and it is value for money","Reviewed in India on 1 February 2024","Best ear buds","5.0 out of 5 stars","https://m.media-amazon.com/images/I/71zyaRTVUBL.jpg","0","Thunder Grey","Extra Large","Nord Buds 2"
"R4DY09MQJL1OJ","Amazon Customer","Useless..","Reviewed in India on 1 February 2024","Not connecting 2 device..","1.0 out of 5 stars","","0","Thunder Grey","Extra Large","Nord Buds 2"
"R3T62F597UCYC7","POOVARASU","Don't go for it.. battery life sucks","Reviewed in India on 1 February 2024","It disconnects many times in a span of less time","1.0 out of 5 stars","","0","Thunder Grey","Extra Large","Nord Buds 2"
"RAA39DYYNVI0R","Yash","It has blutooth connectivity issue , frequently forgets the pair device","Reviewed in India on 1 February 2024","Connectivity issue","2.0 out of 5 stars","","0","Thunder Grey","Extra Large","Nord Buds 2"
"RS661PM8PI9R2","Amazon Customer","Very good. Enjoying it thoroughly.","Reviewed in India on 1 February 2024","Cool, easy to handle, good audio quality","5.0 out of 5 stars","","0","White Marble","Extra Large","Nord Buds"
"RY3EEATM9TNWV","Customer120","One of the buds did not work properly when arrived, only replacement was allowed within 7 days but replacement was not done and instead refund(return) option was forced to me, anyways refund was not credited even after 14 days and now the offer period is gone and if I have to purchase it I have to pay the full price.Thank You Amazon for ruining my purchase, now I feel like I shouldn’t buy anything during sale period.Adios","Reviewed in India on 1 February 2024","The products with offer always turns out defective","1.0 out of 5 stars","","0","Thunder Grey","Extra Large","Nord Buds 2"
"R1W5PBV45LY9XA","Mruga Deshpande","Superb quality. Worth price. Must buy","Reviewed in India on 31 January 2024","Superb quality","5.0 out of 5 stars","https://m.media-amazon.com/images/I/61K8TkdLdjL.jpg","0","Thunder Grey","Extra Large","Nord Buds 2"
"R1H9LRYKI43Z3Z","Ravinderjit","....","Reviewed in India on 31 January 2024","Product is very and useful and worth","5.0 out of 5 stars","","0","Thunder Grey","Extra Large","Nord Buds 2"
"R1TZEQBBYOBBM7","Amazon Customer","Can’t work his app on iPhone don’t buy even touch not working properly","Reviewed in India on 30 January 2024","Not good working","1.0 out of 5 stars","","0","Thunder Grey","Extra Large","Nord Buds 2"
"RRXQLTKIT9L62","Syed ilyas ahmed","Wrost garbage not working properly slow connection low voice","Reviewed in India on 30 January 2024","Wrost","1.0 out of 5 stars","","0","Thunder Grey","Extra Large","Nord Buds 2"
"R32XBWW0PJSXX2","Mahesh Nandam","If you want to use it for different devices by connecting and reconnecting, then user will face the issues as it won't be supportive as fast as we want to connectand one more major issue is only one ear bud is working after 1month of less usage.Waste of money.","Reviewed in India on 30 January 2024","Worst connecting experience and only one bud is working after 2 weeks of time","1.0 out of 5 stars","","0","Thunder Grey","Extra Large","Nord Buds 2"
"R3VQH9NAHJS0GJ","Amazon Customer","Its good for this budget","Reviewed in India on 30 January 2024","Budget buy","5.0 out of 5 stars","","0","Thunder Grey","Extra Large","Nord Buds 2"
"R1BZIA5M0S1EYW","Best","I am in the love with this earpods best things I have specia thing is noice cancellation best best best","Reviewed in India on 29 January 2024","Love","5.0 out of 5 stars","","0","Lightning White","Extra Large","Nord Buds 2"
"RJZ7WDTI8CMIM","Yubraj Rooj","The product is not connecting properly","Reviewed in India on 29 January 2024","Product is good","1.0 out of 5 stars","","0","Thunder Grey","Extra Large","Nord Buds 2"
"RY3BOVE04JMU7","Amrita Chowdhury","very good quality sound.","Reviewed in India on 29 January 2024","heavy quality","5.0 out of 5 stars","","0","Thunder Grey","Extra Large","Nord Buds 2"
"R2V6AZLGDU3V0A","Akash","Anc doesn't work properly. Overpriced should come under 2000","Reviewed in India on 29 January 2024","Voice quality is not good","3.0 out of 5 stars","","0","Thunder Grey","Extra Large","Nord Buds 2"
"RN63Z3K9UCYK6","Anupam t.","I bought these buds on 16th jan only after 15 days of usage,the opening lid of case has got loose and feels like an old product the company should improve the build quality of this product in this price range","Reviewed in India on 29 January 2024","Build quality is poor","1.0 out of 5 stars","","0","Thunder Grey","Extra Large","Nord Buds 2"
"R5XT73EEE6UJ4","The product arrived on time and it is good product ","The product is good in quality and it's been a year since I am using no issues in sound quality but it is uncomfortable and painful if we wear for too much time","Reviewed in India on 29 January 2024","It's uncomfortable","2.0 out of 5 stars","","0","White Marble","Extra Large","Nord Buds"
"R3PIV5J71WHAM5","Amazing sound ","Amazing sound even I can't hear this type of sound","Reviewed in India on 29 January 2024","Sound","5.0 out of 5 stars","https://m.media-amazon.com/images/I/61DXsiy9PdL.jpg","0","Thunder Grey","Extra Large","Nord Buds 2"
"R2ZJGXA37OW9I7","mahesh sawarbandhe","Worst ever. Couldn't connect.","Reviewed in India on 29 January 2024","Don't buy","1.0 out of 5 stars","","0","Thunder Grey","Extra Large","Nord Buds 2"
"R2J21B9F21G35G","Good ",false,"Reviewed in India on 29 January 2024","Nice","3.0 out of 5 stars","https://m.media-amazon.com/images/I/61GUDKKmb8L.jpg","0","Thunder Grey","Extra Large","Nord Buds 2"
"RBMZL9XODZI87","pankaj","I think the old product has been delivered to me.  Because according to the reviews the product is not working.  Sound quality is very bad.  It seems like the product is not from OnePlus.  please replace it and give me another product.","Reviewed in India on 29 January 2024","Fake product receive","1.0 out of 5 stars","","0","Lightning White","Extra Large","Nord Buds 2"
"R3HSX3834LZ1FW","Prabhjot Aulakh","It worked great with my Samsung. I wish they worked with PS5 though but they don't.","Reviewed in India on 28 January 2024","Works Perfectly","5.0 out of 5 stars","","0","Thunder Grey","Extra Large","Nord Buds 2"
"R1U7AD1194SMJI","Amar nath Chand ","Very good sound with noise cancellation.Good to buy","Reviewed in India on 28 January 2024","Nice product","5.0 out of 5 stars","","0","Lightning White","Extra Large","Nord Buds 2"
"R3K1TL9T2799DE","Kashu","It's been 9 month using this buds but facing a sound problem now i to have increase the volume to 80 to 90 percente to listen properly","Reviewed in India on 28 January 2024","sound problem,poor quality","2.0 out of 5 stars","","0","Thunder Grey","Extra Large","Nord Buds 2"
"R2WHM8P76P6A33","Praveen","I have dought on this product. How come I know it's geniune product, waranty card is missing","Reviewed in India on 28 January 2024","Package damaged","1.0 out of 5 stars","https://m.media-amazon.com/images/I/71FB7DIEOtL.jpg","0","Thunder Grey","Extra Large","Nord Buds 2"
"R3U9J7P49I6SFF","Amazon Customer","Price is high but quality is poor. While talking the other parties ask me to remove Bluetooth and then talk. They says that my voice does not reach clear to them.","Reviewed in India on 28 January 2024","Other party can not listen my voice properly. They ask me to remove Bluetooth and then talk.","1.0 out of 5 stars","","0","Thunder Grey","Extra Large","Nord Buds 2"
"RCB96ETORC5GE","Vaibhav Parmar","There is a frequent disconnect with the phone in middle of calls. Hey melody app doesn't support iOS. Useless.","Reviewed in India on 27 January 2024","Frequent disconnect! Useless.","1.0 out of 5 stars","","0","Thunder Grey","Extra Large","Nord Buds 2"
"R17QW4UJP3ORTD","Veer Sharma","Awesome buds! I have to use this approx last 6 months, and It works perfect, battery backup is too good, noise cancellation is perfect. You can easily use for long purpose call it is very comfortable. Many I also forgot where is my earbuds after putting in my ears.","Reviewed in India on 27 January 2024","Perfect for office, gym etc.","5.0 out of 5 stars","","0","Thunder Grey","Extra Large","Nord Buds 2"
"R1HE5HCJE8FVLR","rohit mishra","Battery back is too long bought just one week doest get stand for 4 hrs only","Reviewed in India on 27 January 2024","Battey back up is worst 3hrs only. Shame on u amazon","1.0 out of 5 stars","","0","Thunder Grey","Extra Large","Nord Buds 2"
"R2LVQZLVESCBCA","Mahendra","Mic quality very poor","Reviewed in India on 27 January 2024","I don't like","1.0 out of 5 stars","","0","Thunder Grey","Extra Large","Nord Buds 2"
"R3DJ5GYT4XYURZ","Tushar Yadav","Good sound quality and battery backup.","Reviewed in India on 27 January 2024","Excellent","5.0 out of 5 stars","","0","Thunder Grey","Extra Large","Nord Buds 2"
"RE0PSUJ1EZ06E","Rituparan","Material good and comfortable for carrying.","Reviewed in India on 26 January 2024","Good Quality","5.0 out of 5 stars","","0","Thunder Grey","Extra Large","Nord Buds 2"
"R18FW6W73LG025","Amazon Customer","Not upto standards as claimed by OnePlus","Reviewed in India on 26 January 2024","Not upto standards as claimed by OnePlus","1.0 out of 5 stars","","0","Thunder Grey","Extra Large","Nord Buds 2"
"R1EN81735WNWE9","Subhra Bikas Das","Awesome","Reviewed in India on 25 January 2024","Best in this price range","5.0 out of 5 stars","","0","Lightning White","Extra Large","Nord Buds 2"
"R117NH48KQZR9P","nawaz khan","Balanced sounds bass vocals are perfect super tunings 💯👌","Reviewed in India on 25 January 2024","Superior Quality thanx oneplus","5.0 out of 5 stars","","0","Thunder Grey","Extra Large","Nord Buds 2"
"R3KYBO9J09XJG4","priyanga","I have checked reviews and bought this one. But, it is totally waste and unable to return it","Reviewed in India on 25 January 2024","Please do not waste your money","1.0 out of 5 stars","","0","Lightning White","Extra Large","Nord Buds 2"
"RTPSFPKHAWE85","Shrikant dabral","worth of money","Reviewed in India on 25 January 2024","worth of money","5.0 out of 5 stars","","0","Thunder Grey","Extra Large","Nord Buds 2"
"R39ZMAPJ5IH889","ravi","Good","Reviewed in India on 25 January 2024","Good product","5.0 out of 5 stars","","0","Thunder Grey","Extra Large","Nord Buds 2"
"R2M4HLKZMK2JK7","Sourav Nayak","I you are thinking to buy it . Go on .. Highly recommended .","Reviewed in India on 25 January 2024","Good product","5.0 out of 5 stars","","0","Thunder Grey","Extra Large","Nord Buds 2"
"RZSLZPBW1DXFG","Rahul Saharan","The sound & bas quality is very good but voice noise is too much high","Reviewed in India on 25 January 2024","Voice noise","5.0 out of 5 stars","","0","Thunder Grey","Extra Large","Nord Buds 2"
"R12N9QCCO8PD5W","Amzing quality ","Go for it","Reviewed in India on 25 January 2024","Good quality","5.0 out of 5 stars","","0","Thunder Grey","Extra Large","Nord Buds 2"
"R10HPRNTES2H8C","Nuthan  Patel","Worst earbuds not worth 3000.","Reviewed in India on 24 January 2024","Not worth","1.0 out of 5 stars","","0","Thunder Grey","Extra Large","Nord Buds 2"
"R365AMAMF8QTCU","Anten Ravil Doss","Using this for more than two weeks now and I can easily say that this product is an absolute waste of money. Perfect Chinese product that will easily put your hard earned money into pit.This will work good only with OnePlus mobiles for other mobile owners it will be a nightmare. I do have OnePlus mobile but I also connect this to my laptop for zoom meetings but everytime when I try to connect this in laptop it's an nightmare.Connectivity range is ok but when you want to disconnect, most of the times it gets hanged. It will be totally ridiculous for you to sit and troubleshoot every time.Charge retention is absolute joke. Mostly it will be retained for 3-4 hrs and not more than that. After which you should charge again. It takes 1 hr min to charge completely.After using this you ll come to a conclusion on not to buy OnePlus products again. Just stick to their mobiles and nothing else.","Reviewed in India on 24 January 2024","Don't waste your money!","1.0 out of 5 stars","https://m.media-amazon.com/images/I/71ac1OSeBOL.jpg","0","Thunder Grey","Extra Large","Nord Buds 2"
"R10DH0NNDZT27H","Pursharth","Very great earbuds and also the anc mode is very great.","Reviewed in India on 24 January 2024","VERY GREAT AIR BUDS","5.0 out of 5 stars","","0","Thunder Grey","Extra Large","Nord Buds 2"
"ROI2VWPYPNSX9","Deepak Tyagi","I would have given 1 star, but didn't just because they are comfortable but what can a person do with comfort when the most important aspect of wireless earphone is missing that is battery.They claim 7 hr of battery backup instead it discharges in less than 2 hours.Very disappointed with it.Tried to return on the same day but couldn't and could only reach to service center, that's too hassle.","Reviewed in India on 24 January 2024","Battery backup is so bad","2.0 out of 5 stars","","0","Thunder Grey","Extra Large","Nord Buds 2"
"R1K7SNNIIS2CGM","jaipal singh shekhawat","Battery 🔋 backup good","Reviewed in India on 24 January 2024","Charging cable good","5.0 out of 5 stars","https://m.media-amazon.com/images/I/813MhGnII4L.jpg","0","White Marble","Extra Large","Nord Buds"
"R2MCID8SIT2NQ0","Shahid","Wanted to replace. When called amazon they denied","Reviewed in India on 24 January 2024","Very bad","1.0 out of 5 stars","","0","Thunder Grey","Extra Large","Nord Buds 2"
"RM7D5O42R9STV","Chetan Swarup","This perfectly fits the One Plus Nord Buds 2 ear buds. I would suggest this as must buy.","Reviewed in India on 23 January 2024","Perfectly fits One Plus Nord Buds 2","5.0 out of 5 stars","","0","Thunder Grey","Extra Large","Nord Buds 2"
"R3RHIZE9W29I0X","Shafeel","Bad product","Reviewed in India on 23 January 2024","Iphone me note working","1.0 out of 5 stars","","0","Thunder Grey","Extra Large","Nord Buds 2"
"RUB8K0RN9VBT3","saif","ANC working absolutely fine,Bass 🔊 Quality awesome.Sound clarity 💯 pure.Price is truly worth.Over all I can give 5 star 🌟Thank you amazon & one plus.","Reviewed in India on 23 January 2024","Superb👌 Quality Ear Buds","5.0 out of 5 stars","https://m.media-amazon.com/images/I/61-yyfIO5ML.jpg
https://m.media-amazon.com/images/I/719x5cDONRL.jpg","0","Thunder Grey","Extra Large","Nord Buds 2"
"R2JZMYO8B91063","Sharon salve","Bluetooth Connectivity Issues","Reviewed in India on 23 January 2024","Bluetooth Connectivity Issues","1.0 out of 5 stars","","0","Thunder Grey","Extra Large","Nord Buds 2"
"R395KWW1QZ3E07","Amazon Customer","Hey Melody app not supporting on iphone","Reviewed in India on 22 January 2024","Hey Melody app not supporting on iphone","5.0 out of 5 stars","","0","Thunder Grey","Extra Large","Nord Buds 2"
"R1N6EZL03Z3VSJ","rajesh a r","product and refund is not completed even after 30days","Reviewed in India on 22 January 2024","Very very bad product and refund is not completed even after 30days","1.0 out of 5 stars","","0","Thunder Grey","Extra Large","Nord Buds 2"
"RUJ4CKNKNMDUB","ROHIT GUPTA","Its worthy","Reviewed in India on 22 January 2024","Nice 😊","5.0 out of 5 stars","","0","Thunder Grey","Extra Large","Nord Buds 2"
"RHV56RLD0QIST","Waste of shampoo,,, ","Very impressive this product,, using a one plus mobile,, full enjoy this product... I'm happy with this product...","Reviewed in India on 22 January 2024","Clear sound","3.0 out of 5 stars","https://m.media-amazon.com/images/I/71Pm9QPbAaL.jpg
https://m.media-amazon.com/images/I/71gIhj2PNAL.jpg","0","Thunder Grey","Extra Large","Nord Buds 2"
"RQ1G4IXFW80TE","sanju m","Stopped working after 2 months. Kindly do not buy this product.Please test Bluetooth working with multiple devices","Reviewed in India on 21 January 2024","Stopped working after 2 months","1.0 out of 5 stars","","0","Thunder Grey","Extra Large","Nord Buds 2"
"R1CEOG6UDZT24X","Amazon Customer","This buds not working","Reviewed in India on 21 January 2024","Not able to hear voice in right buds","3.0 out of 5 stars","","0","Thunder Grey","Extra Large","Nord Buds 2"
"R32UOBSNQJED9M","Sam","Best in class","Reviewed in India on 21 January 2024","Good quality sound","5.0 out of 5 stars","","0","Thunder Grey","Extra Large","Nord Buds 2"
"R2Z207PUOPL7XM","Subhash","One of the ear buds stopped working right after 2 days","Reviewed in India on 21 January 2024","One of the ear buds stopped working","1.0 out of 5 stars","","0","Thunder Grey","Extra Large","Nord Buds 2"
"RV9WNO9CZYWB3","Hang ho rha h mob thora jyda hii","Used items was send in the box when it is opening and know ist not returning the product..😌😌😌","Reviewed in India on 21 January 2024","Used items was send.","1.0 out of 5 stars","https://m.media-amazon.com/images/I/619wjmU71QL.jpg","0","Lightning White","Extra Large","Nord Buds 2"
"R2L0F2AR7CWM66","Shaik Mahaboob Valli","Voice is very less & hardly able to listen voice","Reviewed in India on 20 January 2024","Voice is very less","1.0 out of 5 stars","","0","Thunder Grey","Extra Large","Nord Buds 2"
"R3P506U6VIKKWT","pratish nair","Received this yesterday. The product is decent in terms of sound, but I am having severe earache and headache. It starts instantly once I start using it and stays for a long time even when I am not using. They only have replacement policy and no refund. Feel like I’ve made a big mistake buying it","Reviewed in India on 20 January 2024","Ear and headache","1.0 out of 5 stars","","2","Thunder Grey","Extra Large","Nord Buds 2"
"RHIC7FDKGSU5O","Amazon Customer","Sound quality poor !I want a refund but no facility to return for refund!","Reviewed in India on 19 January 2024","Very poor quality","1.0 out of 5 stars","","0","Thunder Grey","Extra Large","Nord Buds 2"
