"id","profileName","text","date","title","rating","images","helpful","variant:colour","variant:size","variant:style name"
"R2WNLDUK4HMAZ1","Bilal umar shaikh","Good.","Reviewed in India on 25 November 2023","Earbuds quality","2.0 out of 5 stars","","0","Lightning White","Extra Large","Nord Buds 2"
"R30V4680CE0LJH","Amazon Customer","The sound quality and mic is okay, the box is light weight but the fit is terrible. You can't walk or jog beyond 50mts as they inevitably slip out. The shape is such and also no rubber lining for a good grip. Not a good investment.","Reviewed in India on 21 November 2023","Not a great fit","2.0 out of 5 stars","","0","Lightning White","Extra Large","Nord Buds 2"
"RK8912Q9A14XI","Ayush kumar","Buds stopped charging even after replacing it worked for few months then again issue happened definitely not recommended","Reviewed in India on 18 November 2023","Buds not charging","2.0 out of 5 stars","","0","White Marble","Extra Large","Nord Buds"
"R2ZORQ0J1JCQOZ","Please Return ","Not working mic","Reviewed in India on 7 November 2023","Please","2.0 out of 5 stars","","0","Thunder Grey","Extra Large","Nord Buds 2"
"R1U3Z9JOUS68MJ","BALAJIREDDY ","Not look as they show","Reviewed in India on 6 November 2023","Quality","2.0 out of 5 stars","","0","White Marble","Extra Large","Nord Buds"
"R2G84GCMWTNSR4","7299874427","Mic is not working properly.","Reviewed in India on 6 November 2023","Unstable Mic","2.0 out of 5 stars","","0","White Marble","Extra Large","Nord Buds"
"R28ZWI1QEEE0IZ","Jayendra kumar kalal","ANC not good...","Reviewed in India on 4 November 2023","OnePlus Earbuds","2.0 out of 5 stars","https://m.media-amazon.com/images/I/71YZy9hushL.jpg","0","Lightning White","Extra Large","Nord Buds 2"
"RNCJZ2BAFWXYF","Aniket","Very big falls off. Not so comfortable","Reviewed in India on 2 November 2023","Size didn't fit its too big","2.0 out of 5 stars","","0","Thunder Grey","Extra Large","Nord Buds 2"
"R3MYCZ9B1R8B05","Omkar D.",false,"Reviewed in India on 30 October 2023","Good product","2.0 out of 5 stars","https://m.media-amazon.com/images/I/61+Vn+Qvc8L.jpg","0","Lightning White","Extra Large","Nord Buds 2"
"R3NX3ES2XE7NJB","Anshul Tripathi","Buy Boat earbuds insted","Reviewed in India on 25 October 2023","DONT BUY Cheap plastic WASTE OF MONEY","2.0 out of 5 stars","","0","Lightning White","Extra Large","Nord Buds 2"
"R1Y6OI4JLMMSOT","Prabhu jagan","Worst","Reviewed in India on 25 October 2023","Worst","2.0 out of 5 stars","","0","Thunder Grey","Extra Large","Nord Buds 2"
"R24GL063GFRO7V","Naveen Kangula","Very low Mic Quality, I shall not suggest for usual calls.","Reviewed in India on 24 October 2023","Very low Mic Quality, I shall not suggest for usual calls.","2.0 out of 5 stars","","0","Thunder Grey","Extra Large","Nord Buds 2"
"R1E00XMKQW118I","AKSHIT","Sounds quality average 😢","Reviewed in India on 20 October 2023","Sound quality average","2.0 out of 5 stars","","0","Thunder Grey","Extra Large","Nord Buds 2"
"R3DBLIO9MLYABN","Satish Kumar","Ordered it on first day of it's introduction, used it for 6 months, now the left ear piece is not connecting sometimes. Need to contact the service centre, will update if they repair/replace it.","Reviewed in India on 19 October 2023","Fantastic but not long lasting","2.0 out of 5 stars","","0","Thunder Grey","Extra Large","Nord Buds 2"
"R1I3307W7EVQQJ","Guddi","Packaging is great..order received in good condition..audio quality of buds is great. overall the product is amazing..","Reviewed in India on 17 October 2023","Product quality","2.0 out of 5 stars","","0","Lightning White","Extra Large","Nord Buds 2"
"RQU3FC2AWISPP","Krishna D","Connectivity issue with iPhone you will not be able to change control there is no app in App Store , Not recommended for IPhones","Reviewed in India on 10 October 2023","Doesn’t work well with IPhone","2.0 out of 5 stars","","0","Thunder Grey","Extra Large","Nord Buds 2"
"R27DML55YB9FQ9","Nivas Reddy","Cons:1. One has to do pairing process every time we switch between 2 devices2. The setup button has to be long pressed to get it discoverable. What if the setup button is damaged?3. Bad mic for phone calls. Sometimes it makes tik-tik-tik noise during phone call4. Seems like it is mostly compatible with OnePlus devices onlyPros:1. Quality of audio is just good2. Noise cancellation & transparency modes3. Find my earbuds feature4. Seems like it is mostly compatible with OnePlus devices only","Reviewed in India on 8 October 2023","Worst pairing process","2.0 out of 5 stars","","0","Lightning White","Extra Large","Nord Buds 2"
"R3VNR5ZJWTLXZ3","Nalshri","The earphones are bulky. Doesn't fit well on ears even after changing the size of plugs and it keeps coming out. The touch works with a lag. If I use both the ear plugs then my head starts aching. My normal earphones with wire works so much better and better sound quality.  Battery life is okay. And colour is nice. I bought white.But overall, there are cheaper products in this category which would work well. This is completely avoidable. Very disappointed.","Reviewed in India on 8 October 2023","Wasted my money","2.0 out of 5 stars","","0","Lightning White","Extra Large","Nord Buds 2"
"R1Y99WTELOJGLM","Anvith","Your bud will upto 4 hours they you have to charge not worth for money","Reviewed in India on 6 October 2023","Look good bad battery backup","2.0 out of 5 stars","","0","Thunder Grey","Extra Large","Nord Buds 2"
"R2RE5OAZG2DJ14","Amazon Customer","Mainstream.. 1k local earphones have better sound quality than this.","Reviewed in India on 21 September 2023","Dont buy","2.0 out of 5 stars","","0","Thunder Grey","Extra Large","Nord Buds 2"
"RZ22DRGKRUL1A","Varun prakash","Earbuds keeps falling from ear and needs to me adjust in ear for every minute... uncomfort on this one.","Reviewed in India on 21 September 2023","Not Fit in ear","2.0 out of 5 stars","","0","Thunder Grey","Extra Large","Nord Buds 2"
"RNQSQXCH7HWAK","Venkateswar Rao Cheepu","Poor voice quality","Reviewed in India on 21 September 2023","Poor voice quality","2.0 out of 5 stars","","0","Thunder Grey","Extra Large","Nord Buds 2"
"R1WYTRH3CHS2ZN","Chandan Shukla","OK, OK, BUT NOT A VERY GOOD..","Reviewed in India on 19 September 2023","CONECTION PROBLEM.","2.0 out of 5 stars","","0","Thunder Grey","Extra Large","Nord Buds 2"
"R2FMYT73N6A79S","Raju","The ear buds doesn't sync directly but through case. Normal calls are not clear and bass heavy. No proper app outside oneplus","Reviewed in India on 18 September 2023","Heavy Bass for normal calls","2.0 out of 5 stars","","0","Thunder Grey","Extra Large","Nord Buds 2"
"R2APDQ35057RYJ","vamshi dhar reddy","I dislike in some areas that we need to always hold the button to pair other devices it makes sometimes irritating","Reviewed in India on 15 September 2023","Performance is good","2.0 out of 5 stars","https://m.media-amazon.com/images/I/61ePnQm6KWL.jpg","0","Lightning White","Extra Large","Nord Buds 2"
"RUMBFZOOP9M9Y","Amazon Customer","Has stopped connecting any of my devices . Absolutely waste of money . I use I Phone .","Reviewed in India on 11 September 2023","Don’t buy","2.0 out of 5 stars","","0","White Marble","Extra Large","Nord Buds"
"R2HFAGQG2PBW2K","Hima Gandi","Here I would never recommend it ... I have give 2 star for the performance.. but the main thing is ...I don't know after I dropped it or its actually the nrg way...One of the ear bud stops working and sometimes the box stops charging...But all you have to do is just charge for a minute and press the back button until the light blinks 5-7 times..","Reviewed in India on 11 September 2023","All are good except the condition","2.0 out of 5 stars","","0","Thunder Grey","Extra Large","Nord Buds 2"
"RHUNYVG0H0WEN","Saurav Kumar Sharma","The charge lasts for 4 hours at max, the sound is not like natural sound its different and causes headache over time. The touch is too sensitive. I got it due to the One Plus brand but its definitely not worth it. I have tried replacing it as I thought one I got might be bad but no the product only is bad. Don't waste your money. If you can go for a higher price go for JBL earbuds, if you can't go for higher price then go for lower priced Oppo earbuds but don't buy this.","Reviewed in India on 11 September 2023","Don't buy it. You will regret","2.0 out of 5 stars","","0","Thunder Grey","Extra Large","Nord Buds 2"
"RM76SLCX54TV","Beast boy Xd","It's connectivity is so bad.it don't switches from one device to another 50% of the time after tap and long press as mentioned. If connecting to a device which is paired already with these buds but not connected last time then it didn't connected to them and i need to put them in the case and pair them once more.Suppose I contacted this to my PC and then i connected it to the phone.then i put my earphones back in the case and then if i want to connect it to my PC 50% of the time it didn't connect and i have to re pair it with my PC which is so annoying.and the battery life also sucks.the only merit of this is its noise cancellation.sometimes its commands also not work.Totally not worth it,far more better options available in another companies.","Reviewed in India on 4 September 2023","Average but its connectivity sucks","2.0 out of 5 stars","","0","Thunder Grey","Extra Large","Nord Buds 2"
"R1ARRPPWPU1DNO","Saikat","Unable to connect","Reviewed in India on 29 August 2023","Unable to connect with Nokia a23 5g","2.0 out of 5 stars","","0","White Marble","Extra Large","Nord Buds"
"R2BYYY8IMZFR4G","Sachin","Bass is goodDesigned well!!","Reviewed in India on 25 August 2023","Suddenly Creates surrounding noise which is very irritating","2.0 out of 5 stars","","0","Lightning White","Extra Large","Nord Buds 2"
"R3L0V2GAUMAMUQ","Ashvini Hatwar","Not good","Reviewed in India on 20 August 2023","Not good","2.0 out of 5 stars","","0","Thunder Grey","Extra Large","Nord Buds 2"
"R1IH2I8DS9NU8N","Rahul","Sound quality is good but noise cancelation is very very poor. I think product price higher than it's the product.","Reviewed in India on 20 August 2023","Noise cancelation","2.0 out of 5 stars","","0","White Marble","Extra Large","Nord Buds"
"R1RZMM2XB6DLRV","Amazon Customer","The sound quality is superb, noise cancellation is good because of connectivity i am not giving more than 2 as i am not able to connect to 2 different devices (Mobile and Laptop) every time i need to reset and then connect and its not that easy to switch between the devices as one in Android and other is Windows. It was not mentioned that it cann't be connect to 2 devices anywhere. And there is no dual device connectivity which is my requirement.","Reviewed in India on 19 August 2023","connectivity","2.0 out of 5 stars","","0","Thunder Grey","Extra Large","Nord Buds 2"
"R3C4LS3VQ5X750","Vansh","Not proper fitting even with extra eartips. Cannot do heavy exercise earbuds fall immediately. Too much wind noise while on anc and transparency mode. Anc is slightly below avg.","Reviewed in India on 18 August 2023","Fitting and anc","2.0 out of 5 stars","","0","Thunder Grey","Extra Large","Nord Buds 2"
"R2TFLTQYOYP9DQ","Abhishek","I certainly would not recommend anybody to buy this as it gives you so much pain in the ear. Even though sound quality, bass, ANC is nice but still if you listening to music or you are in call, you cant attend it for more than 10-15 mins as it starts to pain in the ear so much that you cant bear it.","Reviewed in India on 17 August 2023","Ear Pain","2.0 out of 5 stars","","2","Thunder Grey","Extra Large","Nord Buds 2"
"R282CVMJ2WS79E","Sunny","I am using it from last 1 and half months and they are just okay types... Not good not bad..Sound is too loud but it doesn't have any noise cancellation, all the sounds came out while listening to music that's one of the major disappointment other than that these are just okay","Reviewed in India on 16 August 2023","Not good not bad type","2.0 out of 5 stars","","0","Thunder Grey","Extra Large","Nord Buds 2"
"R1AWQO00R0CZAV","Amazon Customer","Bluetooth is also not connecting","Reviewed in India on 12 August 2023","Not Working","2.0 out of 5 stars","","0","Thunder Grey","Extra Large","Nord Buds 2"
"R1B01YJ0WTTQNR","Abu","Just overpriced , went for the ANC which is nowhere to be experienced. My oppo enco buds have the same audio experience and almost half the price","Reviewed in India on 12 August 2023","ANC is practically a gimmick","2.0 out of 5 stars","","0","Lightning White","Extra Large","Nord Buds 2"
"R12QY1CH37CD4G","Shubham","the left one stopped working after 9 months and often a times they had synchronising problems while playing","Reviewed in India on 11 August 2023","dont buy ,","2.0 out of 5 stars","","0","White Marble","Extra Large","Nord Buds"
"R8ZM7YM1P68HJ","Sai Kiran","pros:1. The buds are under budget.2. Good sound quality for the price.cons:1. Mic quality is very bad especially when sitting under a running fan. Reciever cannot understand anything we talk.2. Noise cancellation creates a pressured feeling in the head which quickly gets uncomfortable.3. cannot answer or cut calls.4. cannot increase or decrease volume.I felt answering and cutting calls should be a basic functionality especially if we are paying 3000.Overall verdict:Good product if you dont use it for calls.feel other buds at a cheaper price can give the same performance as noise cancellation and mic quality are not good.","Reviewed in India on 11 August 2023","Good audio but bad mic","2.0 out of 5 stars","","0","Thunder Grey","Extra Large","Nord Buds 2"
"R3D3GSGJ84BDH","aniruddha","The product sent was of very poor quality. Only few days of usage 45 to be precise, one of the Earbud has conked off for no reason. Probably this product sold on amazon was refurbished or simply not quality passed. Though the product priced at premium has been a low on quality. what is the use if one of the two earbud JUST CONKS OFF ON YOU. hope there is someone to listen to my inputs","Reviewed in India on 10 August 2023","One of the earbud conks off randomly","2.0 out of 5 stars","","0","Thunder Grey","Extra Large","Nord Buds 2"
"R35HXFW3X8GA2F","Vishal","Mic is not that much good","Reviewed in India on 10 August 2023","Not fully satisfied","2.0 out of 5 stars","","0","Thunder Grey","Extra Large","Nord Buds 2"
"R195AMKHI7XSQC","Prakash","Don't prefer for out doors usage, very pathetic. In traffic call clarity is zero. No good ENC or ANC.****","Reviewed in India on 9 August 2023","**** Waste of money**** Pathetic product","2.0 out of 5 stars","","0","Thunder Grey","Extra Large","Nord Buds 2"
"R1IA3MG3G2H7J","Nishant","The battery backup is not good. It keeps on getting dead in less than an hour even after charging it for several hours.","Reviewed in India on 8 August 2023","Bad battery backup","2.0 out of 5 stars","","0","Thunder Grey","Extra Large","Nord Buds 2"
"RKURUUHPVDKL8","Kruti","I want to return the product as the sound quality of product is not good.","Reviewed in India on 7 August 2023","One plus nord buds","2.0 out of 5 stars","","0","Thunder Grey","Extra Large","Nord Buds 2"
"R1XHV4L0R81NZ0","Amazon Customer","The bluetooth connectivity is very weak even when you're close to the device. High sensitivity on the sensors pauses music for any slight touch which makes it difficult to listen songs while on bed.","Reviewed in India on 6 August 2023","Les than average","2.0 out of 5 stars","","0","Lightning White","Extra Large","Nord Buds 2"
"R3SSLWAV0MT41F","Placeholder","Unworthy. Poor experience with one plus.Neither sound , not receiving call , the other end caller can't listen anything in room noise not when in the street and while traveling.My 2500 bucks went in vein.Not Recommend.","Reviewed in India on 6 August 2023","Don't Recommended. It will embarrass you in every aspect.","2.0 out of 5 stars","","0","Thunder Grey","Extra Large","Nord Buds 2"
"R36JYIM3PK3EA3","Apurv","Well well. Writing this review after normal to low usage of almost 4 months.Using it just for calling purpose and around 1hr of video on YouTube or music.So from the day one this product of mine has not impressed me in sound quality and now one day all of sudden volume levels have dropped tremendously that I can barely hear at full volume. This is due to substandard quality of material used while making this product cheaper. No Active Noise Cancellation also. My colleagues would always say why so much noise in background. ANC is just marketing gimmick. Do not expect bass also. I would honestly suggest to go for much better options in market than Oneplus.","Reviewed in India on 5 August 2023","Buy only if you don't care about volume or sound quality","2.0 out of 5 stars","","0","Thunder Grey","Extra Large","Nord Buds 2"
"R38EK0486EDLLV","karthik varma","Firmware problem it is getting disconnected frequently","Reviewed in India on 3 August 2023","Disconnection problem and frequency length is very short","2.0 out of 5 stars","","0","Thunder Grey","Extra Large","Nord Buds 2"
"R3GPF36GUAUQFY","Prudhviraj","Bought it after going through a lot of reviews, but disappointed with the product. Too big n bulky for the ears and has heating issues as well. Overall It's an average product with bad design. My recommendation is to go with other brands with better value for money and better design.","Reviewed in India on 29 July 2023","Not upto mark","2.0 out of 5 stars","","0","Thunder Grey","Extra Large","Nord Buds 2"
"R10IUADKRLKF7Z","CHARULATA  V R","Having connection issues , I have to always forget and pair the device which is obviously not convenient. Maybe I got a faulty product","Reviewed in India on 28 July 2023","BT Connection issues","2.0 out of 5 stars","","0","Thunder Grey","Extra Large","Nord Buds 2"
"R1F4QOWP5Y0PBP","Placeholder","If you have small earhole then dnt buy ....not comfort for long time listen.","Reviewed in India on 27 July 2023","Not fit for all","2.0 out of 5 stars","","0","Thunder Grey","Extra Large","Nord Buds 2"
"R2C68IWVUPTGBX","Aashta k","Product inside is fine.. but I doubt about packaging.. Usually We see a thin plastic sheet on these boxes which was not there when I recieved it.. also worst packaging ever. There was no where amazon mentioned & I got this in a transparent sac which was again broken","Reviewed in India on 24 July 2023","Packaging","2.0 out of 5 stars","https://m.media-amazon.com/images/I/61ye6kt51cL.jpg","0","Thunder Grey","Extra Large","Nord Buds 2"
"R1WW3QQM0FHA1P","Chetan Kumar JH","Sound Quality is Awesome And good. But Design Do not fit for My ears. Design quality Is not good.","Reviewed in India on 23 July 2023","Disign.","2.0 out of 5 stars","","0","White Marble","Extra Large","Nord Buds"
"R1AGQCGDBG1TAI","Amazon Customer","Too much bass that spoils the listening experience.","Reviewed in India on 23 July 2023","Dont buy","2.0 out of 5 stars","","0","Thunder Grey","Extra Large","Nord Buds 2"
"R20D6BN4L4DH8A","Vidya","Poor built in case quality","Reviewed in India on 21 July 2023","Worst","2.0 out of 5 stars","","0","White Marble","Extra Large","Nord Buds"
"RWAN8ASARVD75","Joy","It is suddenly disconnected whth redmi note 10s what is the solution?","Reviewed in India on 19 July 2023","Connectivity","2.0 out of 5 stars","","0","Thunder Grey","Extra Large","Nord Buds 2"
"R3FZNSDSPM2LMV","An irritating product. To get charged.","Very poor controll setup, no option for increasing and decreasing volume.","Reviewed in India on 18 July 2023","Functionality","2.0 out of 5 stars","","0","Lightning White","Extra Large","Nord Buds 2"
"R20KGEOC1PRZ82","Monirul Haque mondal",false,"Reviewed in India on 10 July 2023","Sound quality. Call isue problem iseo problem","2.0 out of 5 stars","https://m.media-amazon.com/images/I/71eNJTKauZL.jpg
https://m.media-amazon.com/images/I/71nW39w3QjL.jpg","0","White Marble","Extra Large","Nord Buds"
"R1ER1K0SE4ZCA3","karthick","I'm writing this review after using it for 3months the product is not upto th Mark ,1) buds getting disconnected if you speak  through buds , you have to reconnect again.2) one side of buds is not working after using for long hoursTry to purchase any another product for this price .","Reviewed in India on 9 July 2023","Product is not upto the mark","2.0 out of 5 stars","","0","Lightning White","Extra Large","Nord Buds 2"
"R2HHXIVO272QPS","Manohar Reddy","Call volume is too low and we can't hear properly other end but music volume is good","Reviewed in India on 8 July 2023","Call volume is too low and we can't hear properly other end","2.0 out of 5 stars","","0","Thunder Grey","Extra Large","Nord Buds 2"
"R20CK8211S17W4","Wasim Sheikh","Battery is poor. Frequent disconnection","Reviewed in India on 8 July 2023","Better look for other tws ...keeps getting disconnected","2.0 out of 5 stars","","0","Lightning White","Extra Large","Nord Buds 2"
"RFRTAF2J945RN","Manish sharma","Bad experience","Reviewed in India on 6 July 2023","Buds nords","2.0 out of 5 stars","","0","Thunder Grey","Extra Large","Nord Buds 2"
"R1U74ZM0R12YL","deepak","After using these ear bud I m facing pain in ears, can u help in return and suggest the better option","Reviewed in India on 6 July 2023","Facing pain in ear","2.0 out of 5 stars","","0","White Marble","Extra Large","Nord Buds"
"RG51UMIJ2OT7A","Amazon Customer","bass make headache","Reviewed in India on 3 July 2023","not balanced sound","2.0 out of 5 stars","","0","Lightning White","Extra Large","Nord Buds 2"
"RU2QOL6A6NN8H","Sat Red","Don't buy ONE PLUS EAR BUDS... Not working properly, I seen many of them(including me) facing issues productsOne plus products are not good","Reviewed in India on 2 July 2023","One plus products are not good","2.0 out of 5 stars","","0","Thunder Grey","Extra Large","Nord Buds 2"
"R38YX64DCTD04G","Veerender","Sound and Bass is really good..but the shape makes ears painful and the worst part.. it can't be replaced or refunded.. Not happy with the service","Reviewed in India on 1 July 2023","Bass n sound is good but painful for ears","2.0 out of 5 stars","","0","Lightning White","Extra Large","Nord Buds 2"
"R25ODORMIA7KPW","DRAVYANSH VERMA","ANC IS USELESS and not comfortable. I need refund","Reviewed in India on 30 June 2023","Not worthy","2.0 out of 5 stars","","0","Thunder Grey","Extra Large","Nord Buds 2"
"R3D3G77ZDARY4E","SURYA","I am using this product for 6+ months. But for the past one month I am facing distortion noises in my right ear bud and it is very annoying. If you raise the volume it will get much worse. It seems most one plus ear buds is having this problem including one plus buds pro. Please go for a better one if you are looking for a term usage.","Reviewed in India on 29 June 2023","Distortion isuue","2.0 out of 5 stars","","0","White Marble","Extra Large","Nord Buds"
"R2EMBS1F2LP9RO","Amazon Customer","I have one plus 6t and still it doesn't connect but I tried with one plus Nord it should up very quickly. After using for 5 days it automatically stopped connecting and if we make the device forge from phone and reconnect it, there is no sound. After reboot again same problem occurred.","Reviewed in India on 27 June 2023","Connecting problem","2.0 out of 5 stars","","0","Thunder Grey","Extra Large","Nord Buds 2"
"R1TWJKTH28HE1X","Rohan sengar","Max you can use this is for 1hr 30min, after that you will feel that kind of pain in your ears actually it starts paining as soon as you put them on. Bass is actually good so powerful that sometimes shadows the music. But in ear fit is something really no so good. Whats the use if you can't use them for longer period of time. Also noise cancellation is ok ok. Sometimes works like charm sometimes not so good, definitely not recommended for calling as other person won't be able to listen to whatever you say unless you starts to scream.","Reviewed in India on 26 June 2023","Comfort level is worst. Bass is actually good","2.0 out of 5 stars","","2","Thunder Grey","Extra Large","Nord Buds 2"
"R1IBPN88S5U4Y9","Md khudrath","Poor sound quality,not satisfied","Reviewed in India on 25 June 2023","Not worth","2.0 out of 5 stars","","0","Thunder Grey","Extra Large","Nord Buds 2"
"R64J0LREVS4VH","SK. SHAH ALAM","Very bad sound quality for call. But songs sound is very good.","Reviewed in India on 25 June 2023","Very bad sound quality for call. But songs sound is very good.","2.0 out of 5 stars","","0","Thunder Grey","Extra Large","Nord Buds 2"
"R12351FOFSHT18","Sravan Kumar","This ear buds are waste, pairing issues...until you unpair it will not connect other device even if you are in 100 kms also...don't buy this product","Reviewed in India on 22 June 2023","Waste ear buds","2.0 out of 5 stars","","0","Thunder Grey","Extra Large","Nord Buds 2"
"R1D3ZKAJRI2AEG","Rupa mythri","There is a lot of sound but there is no bass... sounds getting very sharp like100rps earphones...and They could not hear my voice clearly on call... There is no return option...Very disappointed 😔","Reviewed in India on 21 June 2023","Not good as expected 😕","2.0 out of 5 stars","https://m.media-amazon.com/images/I/71y6ew-Z44L.jpg","0","Thunder Grey","Extra Large","Nord Buds 2"
"RDRAGGYQ7ANKA","Placeholder","Sound quality is ok but not very good","Reviewed in India on 21 June 2023","One plus nord buds2 earbuds","2.0 out of 5 stars","","0","Thunder Grey","Extra Large","Nord Buds 2"
"R2YG5SDUNZZB7R","Userk","Always need to reset before connecting to next device it's irritating and this feature need to be changed","Reviewed in India on 19 June 2023","Couldn't connect multiple devices","2.0 out of 5 stars","","0","Thunder Grey","Extra Large","Nord Buds 2"
"R18M8E5W4YF1VU","Ronak","For phone call the microphone is very bad","Reviewed in India on 18 June 2023","Not good","2.0 out of 5 stars","https://m.media-amazon.com/images/I/81fL2q-IbuL.jpg","0","Thunder Grey","Extra Large","Nord Buds 2"
