"id","profileName","text","date","title","rating","images","helpful","variant:colour","variant:size","variant:style name"
"R3E3MV327DY0VQ","Kavish Dani","I used one plus buds previously and i was not happy with the product as it gave pain in my ears after some use.Well coming to nord 2 buds i was skeptical whether to buy or not. But let me tell you i am totally satisfied with the product this time.Case is very strong the hinge is of superb qualtiy if you shake it the upper part will not shake a little so good built qualtiy and good pairing response. One plus devices will have advantage of auto connect and it doesn't need pairing process to be followed where as for other device you have to download app helomelody for changing the function of buds.Coming to the buds. 5 star voice quality and bass is superb. The fit is so soft and it feels very light in ears. I tried riding bike at 100 while wearing it no issues it was in the place properly also tried shaking the head and running no issues. Buds can be controlled via app helomelody and one plus device have the software built in.Check the app screenshots. First is anc control. You will feel the difference when switching it from anc, off and transparent. You can listen how it will feel when you listen music or speak on call in transparent mode. You can feel the difference awesome feature. Anc will take more battery please note.Sound master let's you select equaliser and increse the bass wave.Game mode is for reducing latency while gaming.Earbud control. You can select 6 functions 3 each buds and that's an upgrade from one plus buds. There is single, double and triple tap. I have keptRight bud double tap next song/take calls, triple tap for previous trackLeft bud double tap voice assistant, 3 nonesingle tap for play for both right and left bud.Touch and hold for changing the anc mode or transparency mode.It also has tap feedback feature means when you tap he word it makes a click sound so that you can know how many times you have tapped the buds. So while you tap it thrice and hear two click sounds that means you have tapped twice and buds will respond to the function assigned to 2 taps.The best feature i found out is device switching. If your buds is paired with multiple devices then you can switch device by tap and hold for 3 secs it will connect to other device easily. I have tried in 2 phones haven't checked for more than 2 device or laptop.Overall it's  worth to buy this buds not to forget all these features on reasonable price. I loved it. It's far better than the one plus buds. Nice work one plus...If you are confused between buds nord and buds nord 2 there is a difference if bluetooth version and drivers that's it.Best and within budget...Edit: while driving the other person will hear lots of noise and speaking on call while driving a 2 wheeler is not at all possible, be aware of that I tried every modes but it just doesn't help.","Reviewed in India on 25 June 2023","Flawless ear buds. Value for money","5.0 out of 5 stars","https://m.media-amazon.com/images/I/61ZjJ6-G6LL.jpg
https://m.media-amazon.com/images/I/61pBXiW1bGL.jpg
https://m.media-amazon.com/images/I/71D1NaWnymL.jpg
https://m.media-amazon.com/images/I/71YVAU7w05L.jpg","38","Thunder Grey","Extra Large","Nord Buds 2"
"R3KZ33F03CZR92","Raj Kriti Sinha","Ordered during Great Indian Festival.Effective price after SBI Discount was Rs. 2250/-I ordered this product after thorough research.And I am happy that for this price, it exceeds my expectations.Design - Similar to Nord Buds the first. But, both the gray and white colors have some faint dotted design over the case and the stem of the buds. Faint flue dots over white. I was not prepared for that, at first glance, it looks a little dusty but can be overlooked.Both the case and buds are very lightweight and easy to carry.However, what I found to be a downside is that the buds dont have any magnetic attraction between them, so while they're easy to place in the case, outside the case they can't be clubbed together.Fit - Fits perfectly. No pain/discomfort. When I move my head from side to side, they stay put. I ran on the treadmill for a few minutes at 12kmph. They didn’t even budge. It didn’t feel like they would slip out. Which is great.Call Quality - The thing I was most worried about. And it passes the test. I live on a quiet street though - The other person is able to hear me loud and clear, and sometimes, ambient sound is also audible to them but the volume of that sound is much lower than my voice so it is not bothersome. Even in busier surroundings, no one has complained about my call quality yet!Audio Quality - I'm quite fond of listening to loud music. This does more than just justice to the loudness. I am more than happy listening at 50% volume. It’s definitely bass heavy. The quality of the sound is clear and crisp. I am very happy.ANC - It was not a priority for me, however, I did try it. Noise cancellation is definitely very effective. It does as much as promised, not more. However, there is a faint hissing sound. But it doesn’t bother me when playing some music or audio.Hey Melody - Its NOT detecting my earbuds yet lol. I'm an apple user. Let's see I'll try pairing it properly.Switching between devices - Unpair with one to pair with another. Not much of a hassle though, its fairly quick. And it automatically pairs with my phone as soon as I take it out of the case.Battery Life - Yet to be explored! I’m someone who carries all my chargers on the go and tend to keep all my devices well charged, so I don’t think I’ll be able to face much issue.My Personal Reasons why I didn't go for Buds Z2 even though my budget was flexible -1. In Ear Detection - if it goes haywire, I don't think there's an option to turn it off.2. Glossy finish - I was afraid it would slip out.3. It was released in 2021. About time we got a Z3, no?Reasons why I wanted Z2 -1. 3 mics2. Google pairing - easy switch between devices3. More premium productAm I happy I went with this and not with Z2 - MOST DEFINITELY YES!!!","Reviewed in India on 10 October 2023","Stop overthinking & trust me on this one - does more than just the job at a budget price!","5.0 out of 5 stars","https://m.media-amazon.com/images/I/61D4h5mku4L.jpg
https://m.media-amazon.com/images/I/61GT6m8ZHlL.jpg","117","Lightning White","Extra Large","Nord Buds 2"
"R2LVN60HHEMJBM","Archit C.","As I've used OnePlus Nord Buds 1 as well so i can say that there is good  improvement made in Oneplus Nord Buds 2.The bass was my first priority so yes I'm satisfied with it, the basswave feature helps a lot at that time. The ANC is okay but it reduces a pretty good amount of surrounding noise. The battery is also very great for bing listening of music.Everything is great in this price as I bought it during Republic Day Sale, which cost for ₹2,499","Reviewed in India on 18 January 2024","Recommended for bass lovers!","4.0 out of 5 stars","https://m.media-amazon.com/images/I/51gfRRwBmKL.jpg
https://m.media-amazon.com/images/I/611Y007P7IL.jpg","0","Thunder Grey","Extra Large","Nord Buds 2"
"R1LRTHRB41IVHV","Hemant Choudhary","Battery: averageFitting: greatSound: ultra greatDesign: fantasticNoise cancellation: okay not great but really work wellConnect 2 device with different earbuds at same timeEasily shift between 2 connected devicesBest earbuds before I try boat airdopes they are not great but OnePlus give something greatAankh band karke khareed lo","Reviewed in India on 24 January 2024","Fitting is much more better than boat and other brands comes at this price range","4.0 out of 5 stars","https://m.media-amazon.com/images/I/61VyvnQtYFL.jpg
https://m.media-amazon.com/images/I/61ej8d4t-2L.jpg
https://m.media-amazon.com/images/I/61m2Su29ycL.jpg
https://m.media-amazon.com/images/I/61sr90k4h2L.jpg","0","Lightning White","Extra Large","Nord Buds 2"
"RQ8OBQBDROXJI","Vishnu deo","Although these tws buds are very nice in its sound quality but it's design is not quite practical for use it for long hours , you won't feel comfortable in wearing these for long hours and sometimes you can pain also.","Reviewed in India on 24 January 2024","Nice but 🙂","4.0 out of 5 stars","https://m.media-amazon.com/images/I/71bO3QUdUCL.jpg","0","Thunder Grey","Extra Large","Nord Buds 2"
"R4CK09VKJ9UR4","Gurumurthy","Got this for 2500 in sale. Interms of connectivity and battery life  it does great. I have to say music listening experience is fascinating especially using only music related app like Spotify. It delivers immersive listening feel.If you ve oneplus mobile than you love this connectivity pop up whenever you open the case, really it is cool😎 to watch.","Reviewed in India on 15 January 2024","Fantastic.. Loved it","4.0 out of 5 stars","https://m.media-amazon.com/images/I/51nep6r09wL.jpg","0","Thunder Grey","Extra Large","Nord Buds 2"
"R2S19VWXM51GOJ","Tanmoy Mondal","Premium sound quality & battery backup also good.","Reviewed in India on 31 January 2024","Oneplus nord buds 2","4.0 out of 5 stars","https://m.media-amazon.com/images/I/71TondiAf4L.jpg
https://m.media-amazon.com/images/I/81717f2fh2L.jpg","0","Thunder Grey","Extra Large","Nord Buds 2"
"RB0GZK2IL40JI","Puspendu ","If you love bass then this is right product you need to buy...","Reviewed in India on 30 January 2024","Bass:-","4.0 out of 5 stars","https://m.media-amazon.com/images/I/71a0H1WpoBL.jpg","0","Thunder Grey","Extra Large","Nord Buds 2"
"R2HGNCWLGNHAGQ","Prosenjit Roy","Good Looking. Sound Quality is impressive. Calling quality ks really good. At Rs.2499 go for it.","Reviewed in India on 23 January 2024","Loved it.","4.0 out of 5 stars","https://m.media-amazon.com/images/I/718btdrcK1L.jpg
https://m.media-amazon.com/images/I/71An-VdCMUL.jpg
https://m.media-amazon.com/images/I/71IK7JGu03L.jpg
https://m.media-amazon.com/images/I/81YJvKx1lSL.jpg
https://m.media-amazon.com/images/I/81ePBYJShQL.jpg","0","Lightning White","Extra Large","Nord Buds 2"
"R2DN5QT9Q7EG5C","Nice pick at good price","Everything is fine, battery and quality is top notch","Reviewed in India on 22 January 2024","Nice pick","4.0 out of 5 stars","https://m.media-amazon.com/images/I/51mXQDVrymL.jpg","0","Lightning White","Extra Large","Nord Buds 2"
"R1KKP22FLLMLYT","Irshad","I will give to 4 star design is good fit in ear goodNoice cancellation goodTransparency I like this feature this is awesome  bass is goodPacking was not good","Reviewed in India on 3 February 2024","After 7 days","4.0 out of 5 stars","","0","Lightning White","Extra Large","Nord Buds 2"
"RIQGZ72P3V36I","Amazon customer","Mention by the company the specification for the product what they say is perfect super birds one if audio profile person with this budget have to surely by this one sound quality and separation is too good.","Reviewed in India on 21 January 2024","One plus Nord 2 buds Thumbs up for the product","4.0 out of 5 stars","","0","Thunder Grey","Extra Large","Nord Buds 2"
"R39CQ80SZRXF6G","PARTH PATEL","Deep bassQuality voice","Reviewed in India on 31 January 2024","Good as I expected","4.0 out of 5 stars","","0","Thunder Grey","Extra Large","Nord Buds 2"
"R1QUZMLQVT56XI","Konda gangadhar","Gd","Reviewed in India on 3 February 2024","Gd","4.0 out of 5 stars","","0","Lightning White","Extra Large","Nord Buds 2"
"R10KZAUEK9A6KF","Placeholder","Sometimes I feels little uncomfort thats it","Reviewed in India on 1 February 2024","Little uncomfort","4.0 out of 5 stars","","0","Thunder Grey","Extra Large","Nord Buds 2"
"R2VC87XIR7741V","Ankit prasad","Nice","Reviewed in India on 28 January 2024","Nice","4.0 out of 5 stars","","0","Thunder Grey","Extra Large","Nord Buds 2"
"R2M2QYSHIIJM0R","Very nice product worth full value ","Very nice buds","Reviewed in India on 1 February 2024","Quick delivery nice product","4.0 out of 5 stars","","0","Thunder Grey","Extra Large","Nord Buds 2"
"R1SH9F65RZVJNB","Krishna","Charging down is very fast","Reviewed in India on 24 January 2024","Charging down","4.0 out of 5 stars","","0","Thunder Grey","Extra Large","Nord Buds 2"
"R1YGHBOPFLI6D2","KOUSHAL SINGH","अच्छा प्रोडक्ट हैं लेकिन नॉइस कैंसिलेशन बिल्कुल भी अच्छा नहीं है म्यूजिक अच्छा है कंफर्टेबल है","Reviewed in India on 24 January 2024","Koushalsingh80@gmail.com","4.0 out of 5 stars","","0","Thunder Grey","Extra Large","Nord Buds 2"
"R1D31ZK2ZASYYR","Nakshatra","Liked the bass and sound quality although they are similar to the other brands below 2k","Reviewed in India on 19 January 2024","Punchy bass and good sound quality","4.0 out of 5 stars","","0","Lightning White","Extra Large","Nord Buds 2"
"RB1ULNOCO7PX","Prashanth","Review after 3 months of usage.ANC - 3.5/5 - for this price range it's good but if you want good ANC then go for OPPO ENCO 2 PRO / REALME BUDS 3sound - 4.5/5- the sound is really nice and clear even in the 70% volume. As the drivers are 12.5mm u cannot hear in the full sound for sure. But if u do hear it then u are either u born with super powers or deaf.Build - 5/5 - overall build quality is excellent. i have dropped the buds  4 times  already, but still it is like a new onecomfort - 5/5 - i personally liked the design and it's really comfortable for me after wearing the buds.overall it is a value for money for this price range. highly recommended.","Reviewed in India on 10 December 2023","value for money buds","4.0 out of 5 stars","","4","Thunder Grey","Extra Large","Nord Buds 2"
"R1YT3VJXSGHOTQ","Nil","If you are getting it in sale, then definitely take it. For even 2500 it is worth the price. Sound quality is good and ANC is quite useful. Nice purchase.","Reviewed in India on 17 January 2024","Worth it","4.0 out of 5 stars","","0","Lightning White","Extra Large","Nord Buds 2"
"R3KLDT33L8EYMI","Shaad","Audio quality is nice .","Reviewed in India on 21 January 2024","Quality","4.0 out of 5 stars","","0","Lightning White","Extra Large","Nord Buds 2"
"R10Y1CB5759JL8","Amit Dwivedi","It has excellent sound quality at this price range","Reviewed in India on 20 January 2024","Excellent sound","4.0 out of 5 stars","","0","Thunder Grey","Extra Large","Nord Buds 2"
"RUAJ9M8H0IXRH","Abhiram","Bass is to good","Reviewed in India on 27 January 2024","Bass","4.0 out of 5 stars","","0","Thunder Grey","Extra Large","Nord Buds 2"
"R2KEKC0XBGGMZY","Manojkanth","Nice vocalsTreble 8/10Bass 9/10Connectivity 8/10Battery 7/10Battery could have been better","Reviewed in India on 16 January 2024","Paisa vasool","4.0 out of 5 stars","","0","Thunder Grey","Extra Large","Nord Buds 2"
"R3LKH2GM6FV87M","atul raj","GOOD SOUND QUALITY","Reviewed in India on 16 January 2024","VERY NICE PRODUCT","4.0 out of 5 stars","","0","Thunder Grey","Extra Large","Nord Buds 2"
"R7CB5NF76EQ1N","Lakshay","Ear buds are very good .Its case is durable and strong with a beautiful color finess.Sound quality is also great, bass is greatMic is also good and no voice is break during calls, Noise cancelation is top notchPlayback time is also commendable","Reviewed in India on 28 December 2023","GREAT PRODUCT","4.0 out of 5 stars","","0","Thunder Grey","Extra Large","Nord Buds 2"
"R2V7A45QEAEAQI","Piyush sethi","Classy product in this price.Noise cancellation is very good.Bass and Volume should be better.","Reviewed in India on 2 February 2024","Nice and classy","4.0 out of 5 stars","","0","Lightning White","Extra Large","Nord Buds 2"
"R2RV02AQKA3AD7","Nachiketa","Product is completely worth the cost, if expecting ANC like apple than its not for you. I have used oppo, realme, boat but from all of them this one is best","Reviewed in India on 31 December 2023","ANC","4.0 out of 5 stars","","0","Thunder Grey","Extra Large","Nord Buds 2"
"R2TJ8ITSE1DTS6","AVINASH MANDAL","Sound quality it's good","Reviewed in India on 14 January 2024","quality","4.0 out of 5 stars","","0","Thunder Grey","Extra Large","Nord Buds 2"
"R1H75B8ACX3FP3","Dev","I did like it .. quite nice quality and buildGood quality anc and sound","Reviewed in India on 16 January 2024","Nord buds2","4.0 out of 5 stars","https://m.media-amazon.com/images/I/71coPgnTljL.jpg","3","Thunder Grey","Extra Large","Nord Buds 2"
"RE9XKSVMDJ05L","Manikanta","Excellent sound quality and there is noise cancellation not upto mark,If anyone looks for only noise cancellation don't buy...","Reviewed in India on 10 January 2024","Sound quality","4.0 out of 5 stars","","0","Thunder Grey","Extra Large","Nord Buds 2"
"R5PWIS4A648AT","ashish dahiya","battery issueloud soundnoise cancellation basicbass goodcharging issue","Reviewed in India on 9 January 2024","amazon vine","4.0 out of 5 stars","","0","Thunder Grey","Extra Large","Nord Buds 2"
"R2Z9ERK9ZWSI6N","4.2","I like the bass sound","Reviewed in India on 10 January 2024","Nice product","4.0 out of 5 stars","","0","Thunder Grey","Extra Large","Nord Buds 2"
"R29U5ISDO1IF8S","One plus nord buds","It's good","Reviewed in India on 11 January 2024","Earbuds","4.0 out of 5 stars","","0","Thunder Grey","Extra Large","Nord Buds 2"
"R30QBI5ESA8TT3","Gagan","rich sound quality and improved battery backup and 25 db anc is awsm....","Reviewed in India on 11 January 2024","Good product","4.0 out of 5 stars","","0","Thunder Grey","Extra Large","Nord Buds 2"
"R3KZCRG430K5BT","Arun Sharma","Bass is little low otherwise can go for purchase","Reviewed in India on 13 January 2024","Bass Quality","4.0 out of 5 stars","","0","Thunder Grey","Extra Large","Nord Buds 2"
"R1GYF68MXMCQBB","Sanjeev","Battery backup is not very good","Reviewed in India on 27 December 2023","Battery backup","4.0 out of 5 stars","","0","Lightning White","Extra Large","Nord Buds 2"
"R1WSI735BS6IJP","Amit Kumar","ANC is namesake","Reviewed in India on 15 January 2024","Nice","4.0 out of 5 stars","","0","Lightning White","Extra Large","Nord Buds 2"
"R3IUQPMYEIDRA5","Ashokprabu K","Design:Good buds, not easily fall from the ears. But the box is not comfortable at jeans pocket, need to be a little comfortable design to keep in pockets.Quality:The quality of the material is really good, Sound quality is good, I cannot say its extraordinary because unable to make a tight push into the ears there is a air gap always, but still the ANC reduces the outside noise good and able to manage and listen the good quality sound.Connectivity:only 6 to 8 meters for a good reception. beyond this will get frequent disconnection. The 6-8 meters also should not have any hurdles then only it will be. While open the box lid it connects to the device a bit annoying, should get connect only when we pick the buds from the box, since there is a magnetic touch given or the buds it should have been handled in that way.Paring:Paring button is on the box near to the charging port, which is really good. should be a little quick responsive for the touch, some times it responses quick some times it did not response for the touch may be its due to the design texture on the touch area.Battery:30 to 40 percent consumption for a 2 hour continuous usage with ANC. Which is quit disappointment, but still it will get charged once we put the buds into the box which is a good thing. Should have to improve the battery consumption a little smarter way. Each buds took different level of consumption I guess this is  due to more touch on one buds.Convenient :For one plus mobile there a dedicated menu given in the Bluetooth setting, to control over the earphone and able to customize the touch controls. may be the touch area can be kept little down to give a good convenience to put the earphone a good push to ears. because when we try to tight the earphones the touch responses which is annoying.","Reviewed in India on 25 October 2023","Acceptable ANC Good Sound","5.0 out of 5 stars","","7","Thunder Grey","Extra Large","Nord Buds 2"
"R3LYFVSLKLZSAT","Subhash","Cost wise can save up to 700,only difference is u won't get active noise cancellation.Rest all good .","Reviewed in India on 23 December 2023","Go for OnePlus buds 2r","4.0 out of 5 stars","","0","Thunder Grey","Extra Large","Nord Buds 2"
"R3MJMZ7T7AIEB1","Zaheer Ahmed","Good Sound QualityBuild Quality","Reviewed in India on 30 January 2024","Buds 2 pro","4.0 out of 5 stars","","0","Thunder Grey","Extra Large","Nord Buds 2"
"R2YXPAFMEGLUGZ","Shantanu Basu","Not bad","Reviewed in India on 29 December 2023","Decent","4.0 out of 5 stars","","0","Thunder Grey","Extra Large","Nord Buds 2"
"R3BN3ZDQMA9V95","SJ","I loved wired earphones even in this era. After having such long thought I just ordered it. And I am amazed by the product. Totally worth it.","Reviewed in India on 16 December 2023","I can’t believe that K liked it.","4.0 out of 5 stars","","0","Thunder Grey","Extra Large","Nord Buds 2"
"R39E6KY8GPT4B2","Rayan","Best sound","Reviewed in India on 30 December 2023","So cool","4.0 out of 5 stars","","0","Thunder Grey","Extra Large","Nord Buds 2"
"R1RE921K5IVEXI","VD","Nice product. working well since 2 months. Sound quality is superb.","Reviewed in India on 12 January 2024","Good product with clear sound.","4.0 out of 5 stars","","0","Thunder Grey","Extra Large","Nord Buds 2"
"RHL92Q6BENJ4B","sanjeet kumar","Best","Reviewed in India on 18 January 2024","Best","4.0 out of 5 stars","","0","Thunder Grey","Extra Large","Nord Buds 2"
"R17V4LR1L4CK3B","Amazon Customer","While using Instagram call automatically unpaired","Reviewed in India on 9 January 2024","Unpaired","4.0 out of 5 stars","","0","Thunder Grey","Extra Large","Nord Buds 2"
"R2TPSMK5ZM047D","Placeholder","Audio quality is good not as good as jbl but overall it is a good product","Reviewed in India on 24 December 2023","Good product","4.0 out of 5 stars","","0","Thunder Grey","Extra Large","Nord Buds 2"
"R1JDHYVSDAK4XS","S.K VIGNESH","ANC AND SOUND QUALITY ARE GOOD, BUT FACING A FEW BUGS WHEN CONNECTING TO DEVICES, HAVE TO RESET AND REPAIR , BUT ITS ALRIGHT , DURABLE TOO","Reviewed in India on 24 December 2023","VERY GOOD ACTUALLT AT THAT PRICE, BUT!","4.0 out of 5 stars","","0","Thunder Grey","Extra Large","Nord Buds 2"
"RT9ZHPVAYAHUU","Deep Chandra Saini","Nice quality","Reviewed in India on 10 January 2024","Very nice","4.0 out of 5 stars","","0","Thunder Grey","Extra Large","Nord Buds 2"
"R2WTNVZFB0DD9Q","abi","Good product and value for money","Reviewed in India on 6 January 2024","Good product and value for money","4.0 out of 5 stars","","0","Thunder Grey","Extra Large","Nord Buds 2"
"R3822C4N4HNS63","Prem singh","Nice item","Reviewed in India on 1 January 2024","Good product","4.0 out of 5 stars","","0","Thunder Grey","Extra Large","Nord Buds 2"
"R1TKVYRNS9GBPY","Ruthra","after 15 minutes ear will  pain.......","Reviewed in India on 6 January 2024","EAR PAIN","4.0 out of 5 stars","","0","Lightning White","Extra Large","Nord Buds 2"
"RG1320Z7RELUT","Anmol Agnihotri","Sound quality is beyond good.Bass enhancement is awesome.","Reviewed in India on 12 January 2024","ANC like never before! Damn!","4.0 out of 5 stars","","2","Thunder Grey","Extra Large","Nord Buds 2"
"R2LH0K6CH6FT8K","Aihab Umair","The sound quality especially the bass is amazing. The buds would glitch sometimes for a millisecond or two but mostly it is fine. The only thing I don't like about this product is it doesn't support dual pairing of devices.","Reviewed in India on 19 December 2023","Good product but no dual pairing","4.0 out of 5 stars","","0","Thunder Grey","Extra Large","Nord Buds 2"
"R7GVA4AD2T0WN","Prashanth","Sound of the earbud was totally awesome and best bass effect as well as good for Outdoor experience","Reviewed in India on 28 December 2023","Quality of the Sound","4.0 out of 5 stars","","0","Thunder Grey","Extra Large","Nord Buds 2"
"R1MF5WQU14K16L","Aman","It's a decent product like you fell good to have it but volume not good as pricing.","Reviewed in India on 29 December 2023","Volume is no up to the mark.","4.0 out of 5 stars","","0","Thunder Grey","Extra Large","Nord Buds 2"
"R2SSNP29HN7UFD","D","Pro:-Fits very wellLong lasting bettryNoise cancellation is OkayishCons:-After the update, Changing from one device to another is pain. I have to repair the device most of the times.","Reviewed in India on 26 December 2023","Overall Good with few Obvious problems","4.0 out of 5 stars","","0","Thunder Grey","Extra Large","Nord Buds 2"
"R27U3K4N9I933I","Eswarreddy","I like it","Reviewed in India on 1 January 2024","I like it's performace and the product quality","4.0 out of 5 stars","","0","Thunder Grey","Extra Large","Nord Buds 2"
"R3QHMYULCL2NZ4","KRISHTIFFER","Pros:The OnePlus Nord Buds 2 impresses with amazing bass, sound quality, and user-friendly app control. The battery backup is commendable, and the ""find your buds"" feature adds convenience. The ANC functionality, with three modes, enhances the overall listening experience. Mic is also good for calls.Cons:The only drawback is the occasionally frustrating touch controls, often misinterpreting taps.Overall:OnePlus Nord Buds 2 stand out in the market with premium sound quality and features. While the touch control issue deducts a star, the product's overall excellence and OnePlus's reliable after-sales service make it a top choice in its category. It sets a high standard for competitors to prioritize product improvement over marketing.","Reviewed in India on 19 November 2023","Exceptional Sound, But Touch Controls Fall Short","4.0 out of 5 stars","https://m.media-amazon.com/images/I/61qsU38TqsL.jpg","5","Lightning White","Extra Large","Nord Buds 2"
"R1LVDYUUFCXCRY","Shubham Upadhyay","Bass and voice is amazing, The case lasts for 32 hours of charging, and the buds last for 6 hours of charging at a time.","Reviewed in India on 27 December 2023","Bass and voice.","4.0 out of 5 stars","","0","Thunder Grey","Extra Large","Nord Buds 2"
